by,dead,discussion_id,score,text,time,timestamp,title,type,url,date,stars_at_submission,stars_month_1,stars_month_2,stars_month_3,stars_month_4,stars_month_5,commits_at_submission,commits_month_1,commits_month_2,commits_month_3,commits_month_4,commits_month_5,pull_requests_at_submission,pull_requests_month_1,pull_requests_month_2,pull_requests_month_3,pull_requests_month_4,pull_requests_month_5,forks_at_submission,forks_month_1,forks_month_2,forks_month_3,forks_month_4,forks_month_5,contributors_at_submission,contributors_month_1,contributors_month_2,contributors_month_3,contributors_month_4,contributors_month_5
cmpxchg16,,37076036,1,,1691674766,2023-08-10 13:39:26 UTC,Engineering Gen AI Assistant,story,https://github.com/genia-dev/GeniA,10/8/2023 13:39,72,38,148,35,22,11,107,14,0,6,0,0,0,0,2,4,0,0,3,4,32,13,4,7,3,2,1,4,0,0
tmoneyy,,37082117,190,,1691703437,2023-08-10 21:37:17 UTC,Llama 2 on ONNX runs locally,story,https://github.com/microsoft/Llama-2-Onnx,10/8/2023 21:37,729,54,31,28,20,25,2,0,1,7,2,0,7,0,2,3,2,1,50,2,4,7,7,3,2,0,2,2,3,1
uillem,,37087739,9,,1691755619,2023-08-11 12:06:59 UTC,"Uillem – an offline, containerized LLM interface",story,https://github.com/paolo-g/uillem,11/8/2023 12:06,1,1,0,0,0,0,8,1,0,2,0,0,0,0,0,0,0,0,0,0,0,1,0,0,1,1,0,1,0,0
richardliaw,,37091312,2,,1691774840,2023-08-11 17:27:20 UTC,Ray – an open source project for scaling AI workloads,story,https://github.com/ray-project/ray,11/8/2023 17:27,526,615,513,454,413,447,1185,742,1227,694,767,915,1534,986,1118,789,732,776,93,107,83,77,90,99,86,87,88,78,74,71
thunderbong,,37097499,2,,1691820741,2023-08-12 06:12:21 UTC,OpenPlugin: Seamlessly integrate with OpenAI's ChatGPT plugins via API,story,https://github.com/CakeCrusher/openplugin,12/8/2023 6:12,31,0,0,2,5,3,9,0,0,0,0,0,5,0,0,0,0,0,2,0,0,0,0,1,2,0,0,0,0,0
alwex,,37103757,4,,1691870728,2023-08-12 20:05:28 UTC,LLM Guard: An Open-Source Toolkit for Secure LLM Adoption at Scale,story,https://github.com/laiyer-ai/llm-guard,12/8/2023 20:05,23,208,60,107,86,86,18,99,97,93,50,64,8,27,10,20,20,19,3,23,10,7,8,9,2,5,3,3,4,5
mutant_glofish,,37105352,89,,1691885477,2023-08-13 00:11:17 UTC,Doctor GPT: A Large Language Model That Can Pass the US Medical Licensing Exam,story,https://github.com/llSourcell/DoctorGPT,13/8/2023 0:11,2959,171,0,0,0,0,5,5,0,0,0,0,9,6,0,0,0,0,285,28,0,0,0,0,8,1,0,0,0,0
peter_d_sherman,,37107101,72,,1691906254,2023-08-13 05:57:34 UTC,Generative AI – A curated list of Generative AI projects and services,story,https://github.com/steven2358/awesome-generative-ai,13/8/2023 5:57,1532,248,200,195,225,190,34,10,4,6,3,10,33,7,3,6,8,15,89,30,23,22,28,31,18,5,4,5,9,7
taubek,,37112741,891,,1691951715,2023-08-13 18:35:15 UTC,Azure ChatGPT: Private and secure ChatGPT for internal enterprise use,story,https://github.com/microsoft/azurechatgpt,13/8/2023 18:35,4926,0,0,0,0,0,45,0,0,0,0,0,81,0,0,0,0,0,643,0,0,0,0,0,27,0,0,0,0,0
henrycunh,,37114859,1,,1691963208,2023-08-13 21:46:48 UTC,Show HN: Function calling on Claude 2 and Cohere with good DX powered by Cursive,story,https://github.com/meistrari/cursive-py,13/8/2023 21:46,122,11,12,3,2,2,20,2,3,0,0,0,15,2,1,0,0,0,16,0,0,0,0,0,6,2,1,0,0,0
thinkingjimmy,,37119112,50,,1692005844,2023-08-14 09:37:24 UTC,Show HN: A free course on how to write a good Midjourney/ChatGPT prompt,story,https://github.com/thinkingjimmy/Learning-Prompt,14/8/2023 9:37,182,67,52,64,52,48,19,1,0,0,0,0,0,2,0,0,0,0,12,6,1,8,4,8,1,2,0,0,0,0
omarsar,,37120702,1,,1692019068,2023-08-14 13:17:48 UTC,Tracking an LLM Evaluator Using Comet,story,https://github.com/dair-ai/llm-evaluator,14/8/2023 13:17,9,1,0,1,0,3,0,0,0,0,0,0,0,0,0,0,0,0,1,0,0,0,0,0,0,0,0,0,0,0
olalonde,,37120788,4,,1692019553,2023-08-14 13:25:53 UTC,"AgentGPT: Assemble, configure, and deploy AI Agents in the browser",story,https://github.com/reworkd/AgentGPT,14/8/2023 13:25,728,669,532,546,488,464,297,42,25,35,1,1,150,67,68,69,26,48,177,132,122,104,111,100,15,9,10,7,5,6
flavianh,,37122766,1,,1692029658,2023-08-14 16:14:18 UTC,LLPhant – A Comprehensive PHP Generative AI Framework Using GPT4,story,https://github.com/theodo-group/LLPhant,14/8/2023 16:14,162,66,71,25,19,80,35,4,70,8,12,19,9,5,36,11,13,17,6,2,7,6,5,7,2,2,6,4,4,4
jallen_dot_dev,,37123863,6,"If you have tried GitHub&#x27;s Copilot Chat, then this will look familiar to you.<p>The main difference, however, is you can choose which LLM to talk to. So far OpenPilot supports GPT 3.5&#x2F;4 and Google PaLM 2. I&#x27;d like to add support for more models (Claude 2, etc) but have been stuck on waiting lists so I haven&#x27;t tested them.<p>OpenPilot will give context to your prompts by automatically including relevant files from your workspace. You don&#x27;t need to have the file open or manually highlight the code in question. It does this using 2 techniques:<p>1. All the files in your workspace are transformed into embeddings and stored in a DB (Chroma). When you enter a prompt, OpenPilot performs a similarity search to try to find the files you are talking about.<p>2. It uses a two-step process when communicating to the LLM. It first asks the LLM what files it needs to see in order to answer your prompt, passing along the file paths that matched. This lets the model confirm whether the files are really relevant, so we don&#x27;t pollute the context with irrelevant info. It also gives it a chance to specify any files that didn&#x27;t semantically match, which it might be able to infer exist based on your prompt and the structure of your project given the file paths it has seen. Finally, the prompt is resubmitted along with the contents of the files it asked for.<p>Another feature of OpenPilot that Copilot Chat doesn&#x27;t (yet) have is the ability to apply diffs. In Copilot Chat, you can insert code at your cursor position. I think OpenPilot&#x27;s diffs have more potential because you can 1) both add and remove lines, 2) make changes in multiple places, and 3) edit a file you don&#x27;t have open, or even multiple files.<p>Unfortunately, GPT 3.5 is pretty bad at formatting diffs, in my experience. This is why I&#x27;ve put it behind a toggle. Some work needs to be done here.<p>I would appreciate any feedback. If there is interest in this, I&#x27;d like to continue iterating on it. An obvious next step would be adding support for a locally-running LLM. Along with better strategies for finding relevant context, and better UX in general. Thanks!",1692034202,2023-08-14 17:30:02 UTC,"Show HN: OpenPilot, an open-source AI coding assistant for VS Code",story,https://github.com/jallen-dev/openpilot,14/8/2023 17:30,9,0,0,1,2,0,3,0,0,0,0,0,0,0,0,0,0,0,1,0,0,0,0,1,1,0,0,0,0,0
ykhli,,37128293,429,"Hi HN community! We want to share AI-town, a deployable starter kit for building and customizing your own version of AI simulation - a virtual town where AI characters live, chat and socialize.<p>Inspired by great work from the Stanford Generative Agent paper (<a href=""https:&#x2F;&#x2F;arxiv.org&#x2F;abs&#x2F;2304.03442"" rel=""nofollow noreferrer"">https:&#x2F;&#x2F;arxiv.org&#x2F;abs&#x2F;2304.03442</a>).<p>A few features: - Includes a convex.dev backed server-side game engine that handles global state - Multiplayer ready. Deployment ready - 100% Typescript  - Easily customizable. You can fork it, change character memories, add new sprites&#x2F;tiles and you have a custom AI simulation<p>The goal is to democratize building your own simulation environment with AI agents. Would love to see the community build more complex interactions on top of this. Let us know what you think!<p>Demo: <a href=""https:&#x2F;&#x2F;www.convex.dev&#x2F;ai-town"" rel=""nofollow noreferrer"">https:&#x2F;&#x2F;www.convex.dev&#x2F;ai-town</a><p>I made a world Cat Town to demonstrate how to customize AI town. Using C(h)atGPT :)<p>Demo: <a href=""https:&#x2F;&#x2F;cat-town.fly.dev&#x2F;"" rel=""nofollow noreferrer"">https:&#x2F;&#x2F;cat-town.fly.dev&#x2F;</a> Code: <a href=""https:&#x2F;&#x2F;github.com&#x2F;ykhli&#x2F;cat-town"">https:&#x2F;&#x2F;github.com&#x2F;ykhli&#x2F;cat-town</a>",1692056762,2023-08-14 23:46:02 UTC,"Show HN: AI-town, run your own custom AI world SIM with JavaScript",story,https://github.com/a16z-infra/ai-town,14/8/2023 23:46,4651,360,169,184,178,158,67,19,77,7,14,5,63,12,60,6,19,4,324,45,34,27,28,26,18,5,4,4,6,3
gaocegege,,37129330,2,,1692065433,2023-08-15 02:10:33 UTC,AI Based NPC System,story,https://github.com/litanlitudan/skyagi,15/8/2023 2:10,29,29,16,6,6,5,6,0,0,0,0,0,4,0,0,0,0,0,4,1,2,0,0,1,3,0,0,0,0,0
jawerty,,37133444,13,"Hi HN,<p>Yesterday I live streamed myself for 6 hours building this from scratch. It’s an AI agent that uses Llama 2 (so far the 13b chat model) to generate a full react codebase from a single prompt. It had a “dev loop” that iterates on your feedback and resolves dependencies.<p>In the end it kinda worked and I got excited so wanted to post here haha. Long story short a viewer on my discord suggested I build in of these and I just had to look into how these work (inspired by GPT Engineer and AutoGPT)<p>I wanted to work on a more specific downstream task so I focused on web dev. Llama 2 isn’t the best option for this so I will look into utilizing a chat fine tuned starcoder or fine tune llama 2 myself for better results.<p>In the end I spend only some compute units testing this 1000 times on a single gpu I had in Colab and has some pretty solid results for iterating in a fairly short amount of time. Going to build upon this more in the coming weeks (clean the code…).<p>Let me know what you think!<p>Livestream: <a href=""https:&#x2F;&#x2F;www.youtube.com&#x2F;live&#x2F;6_sdnYDmUmo?feature=share"">https:&#x2F;&#x2F;www.youtube.com&#x2F;live&#x2F;6_sdnYDmUmo?feature=share</a>",1692104515,2023-08-15 13:01:55 UTC,"Show HN: 10x-React-Engineer, Generate Entire React Codebases with Llama 2",story,https://github.com/jawerty/10x-React-Engineer,15/8/2023 13:01,65,15,3,4,0,0,13,0,0,0,0,0,15,0,0,0,0,0,6,2,0,0,0,0,2,0,0,0,0,0
Palmik,,37143144,3,,1692163471,2023-08-16 05:24:31 UTC,ExLlama: Memory efficient way to run Llama,story,https://github.com/turboderp/exllama,16/8/2023 5:24,371,246,123,121,69,63,10,6,0,0,0,0,13,4,0,0,0,2,29,10,6,10,7,4,8,3,0,0,0,1
zuccs,,37143721,5,"Following on from this post (<a href=""https:&#x2F;&#x2F;news.ycombinator.com&#x2F;item?id=37094463"">https:&#x2F;&#x2F;news.ycombinator.com&#x2F;item?id=37094463</a>), I was intrigued to find which big sites would follow suit, so I started collating a list of them.<p>Interestingly, it&#x27;s also now being included in codebases by default (like Mastodon).",1692169800,2023-08-16 07:10:00 UTC,Show HN: List of public sites blocking ChatGPT Bot,story,https://github.com/zuccs/disallow-chatgpt,16/8/2023 7:10,13,0,0,0,0,0,17,0,0,0,0,0,0,0,0,0,0,0,0,0,0,0,0,0,1,0,0,0,0,0
thushanfernando,,37144178,1,,1692174164,2023-08-16 08:22:44 UTC,LangUI – open-source Tailwind library AI and GPT projects,story,https://github.com/ahmadbilaldev/langui,16/8/2023 8:22,1035,84,109,125,45,108,4,0,1,0,0,0,3,0,0,0,0,0,40,7,3,4,2,7,3,0,1,0,0,0
todsacerdoti,,37147646,2,,1692196331,2023-08-16 14:32:11 UTC,LLaMA2-Accessory: An Open-Source Toolkit for LLM Development,story,https://github.com/Alpha-VLLM/LLaMA2-Accessory,16/8/2023 14:32,127,127,111,182,141,103,53,53,49,46,55,17,4,4,2,7,7,22,8,8,7,16,11,10,7,7,5,7,7,5
mayankchhabra,,37148210,225,,1692198309,2023-08-16 15:05:09 UTC,"Show HN: LlamaGPT – Self-hosted, offline, private AI chatbot, powered by Llama 2",story,https://github.com/getumbrel/llama-gpt,16/8/2023 15:05,731,731,498,343,247,218,0,0,1,0,0,0,3,3,6,1,3,0,53,53,49,33,23,25,3,3,4,1,3,0
dillionverma,,37148410,6,"Hi hacker news,<p>My name is Dillion and I&#x27;m the creator of llm.report.<p>A few months ago, I was frustrated by the lack of observability into the OpenAI API.<p>All of us are left in the dark about API performance, latency, cost calculation, cost breakdown, and more. I just wanted to know more about how my AI app is performing in production and make data-driven decisions to improve the product.<p>So I ended up just building it myself.<p>There are three parts to the platform:<p>1. OpenAI API Dashboard (no-code) - Enter your OpenAI key and get access to detailed insights straight from the OpenAI API itself<p>2. Logging - Log all your requests &#x2F; responses to OpenAI to analyze cost, latency, token usage and more<p>3. User Metrics - Calculate your cost per user to figure out who your power users are, and how much they cost you per day<p>Would appreciate any feedback you have! Would you use something like this? Why or why not?",1692199067,2023-08-16 15:17:47 UTC,Show HN: Llm.report – Open-source logging and analytics for OpenAI,story,https://github.com/dillionverma/llm.report,16/8/2023 15:17,110,110,78,39,20,19,23,23,7,3,0,1,8,8,0,0,1,2,13,13,7,2,4,1,2,2,2,2,1,2
rahimnathwani,,37154888,2,,1692225918,2023-08-16 22:45:18 UTC,GPT-oracle-trainer: AI to finetune a chatbot about a product's documentation,story,https://github.com/mshumer/gpt-oracle-trainer,16/8/2023 22:45,14,14,5,2,2,2,0,0,0,0,0,0,0,0,0,0,0,0,3,3,0,0,1,0,0,0,0,0,0,0
deusrex,,37162061,5,"Hi HN!<p>Last night, I live streamed myself coding this Llama 2 Agent on a Single GPU (Colab). After 6 hours it actually has some good results.<p>How it works is it takes in your intuition (e.g. &quot;I think x would be cool&quot;) and develops a business idea (with a name and branding colors) and a business plan. After the business plan is developed, it criticizes this plan recursively until the &quot;Investor&quot; prompt is satisfied with the plan. After all this it will generate the final MVP idea and pass it to a the React Engineer Agent I live coded 2 days ago (<a href=""https:&#x2F;&#x2F;github.com&#x2F;jawerty&#x2F;10x-react-engineer"">https:&#x2F;&#x2F;github.com&#x2F;jawerty&#x2F;10x-react-engineer</a>). Finally once the code is generated you have an option to pivot.<p>As for the AI&#x27;s memory, I have a small vector db for history of good intuition+idea examples to use as context (builds as you generate) and a simple backlog of business idea criticisms.<p>Overall, this experiment showed me that you definitely don&#x27;t need OpenAI keys to have an effective LLM Agent for you. This is only using the Llama 13b parameter chat model and doing a wonderful job. I spend maybe 5 dollars of Colab compute building this for 6 hours which is way more than it would be to mess around with this.<p>One caveat is the final react code base often needs some modifications to the package.json&#x2F;webpack setup. However, It&#x27;s generating the components&#x2F;folder surprisingly well starting from the entrypoint file. I addressed most of these concerns in this video but still going to fine tune a model that&#x27;s way better in my next video or just move to a fine-tuned starcoder for this portion.<p>Let me know what you think and play around with the Colab if you can!<p>The live stream: <a href=""https:&#x2F;&#x2F;youtube.com&#x2F;live&#x2F;ZCyxDRSw0wE"">https:&#x2F;&#x2F;youtube.com&#x2F;live&#x2F;ZCyxDRSw0wE</a> The 10X-React-Engineer: <a href=""https:&#x2F;&#x2F;github.com&#x2F;jawerty&#x2F;10x-react-engineer"">https:&#x2F;&#x2F;github.com&#x2F;jawerty&#x2F;10x-react-engineer</a><p>If you want to see me live code more let me know any ideas you&#x27;d like to see built. I&#x27;ve been streaming projects like these most days this past month and don&#x27;t feel like stopping haha.",1692282120,2023-08-17 14:22:00 UTC,"Show HN: AutoStartup, A Llama 2 Agent That Plans and Builds Your Startup Ideas",story,https://github.com/jawerty/AutoStartup,17/8/2023 14:22,11,2,3,3,0,0,0,0,0,0,0,0,0,0,0,0,0,0,3,1,0,0,0,0,0,0,0,0,0,0
yding,,37175570,1,,1692366540,2023-08-18 13:49:00 UTC,Show HN: LitLLM the Spiciest LLM Wrapper,story,https://github.com/yisding/litllm,18/8/2023 13:49,3,0,1,0,0,0,0,0,0,0,0,0,0,0,0,0,0,0,0,0,0,0,0,0,0,0,0,0,0,0
mlejva,,37175807,5,,1692367669,2023-08-18 14:07:49 UTC,SDKs for AI Agents,story,https://github.com/e2b-dev/awesome-sdks-for-ai-agents,18/8/2023 14:07,84,96,40,0,0,0,7,14,7,0,0,0,2,2,2,0,0,0,2,10,2,0,0,0,2,2,2,0,0,0
thomashop,,37197966,1,,1692529191,2023-08-20 10:59:51 UTC,Nuclear Codes: A ChatGPT Multi-Agent Simulation,story,https://github.com/pollinations/cooperative-evolving-gpts,20/8/2023 10:59,0,1,0,0,1,0,0,0,0,0,0,0,0,0,0,0,0,0,0,0,0,0,0,0,0,0,0,0,0,0
today072,,37198357,9,"Hi everyone, nice to meet you and I am a newcomer of HN.<p>I have made a binary tool Aih that could communicate with Bard, ChatGPT, Claude, and Llama(HuggingChat) from the terminal. <a href=""https:&#x2F;&#x2F;github.com&#x2F;Databingo&#x2F;aih"">https:&#x2F;&#x2F;github.com&#x2F;Databingo&#x2F;aih</a><p>Since CAPTCHA challenges and bots detecting have become increasingly difficult, I&#x27;ve changed my strategy from hacking the APIs to simulating a real browser&#x27;s action. The tool first takes the logged-in cookies of Google, ChatGPT, Claude, and HuggingChat accounts from the real Chrome browser, then it opens an invisible instance of Chromium for communication, then displays the answers in terminal.<p>I think it&#x27;s useful especially when I am researching some topics and need to compare answers of those AI models at the same time.<p>Feel free to test and welcome provide feedback!",1692533427,2023-08-20 12:10:27 UTC,Show HN: Talk to AI Models in Terminal,story,https://github.com/Databingo/aih,20/8/2023 12:10,2,2,2,0,2,0,77,5,6,0,2,0,0,0,0,0,0,0,0,0,0,0,1,0,1,1,1,0,1,0
swyx,,37200592,12,"Hi HN, we&#x27;re Sean, Alec, and swyx, and we&#x27;ve been hacking on this side project that harmonizes all the major AI chat apps (Closed LLMs, Open Source Hosted LLMs, and Local&#x2F;GGML ones too) and lets you invoke them in one keyboard shortcut.<p>I originally made this as a smol menubar app that could quickly access ChatGPT from wherever I was on desktop. This necessitated writing an Electron app, rather than a Chrome extension. I also didn&#x27;t have access to the GPT-4 API at the time, so I preferred to use GPT-4 via the full webapp.<p>Then Bing came out strong, and Bard, and Claude, and Llama, and Vicuna, and Falcon and on and on, and other people kept reporting amazing SOTA results on model after model and I felt hopelessly behind - either you just take benchmark results at face value, or you spend serious time copying and pasting chats just to get a feel for the practical differences between the various closed&#x2F;open source LLMs.<p>The real value came when I started just running every query past 3-5 chats at once, and started getting a sense for what each was good at. Bing&#x2F;You.com is (obviously) good at search, but so is Perplexity. Claude 2 wins about 30% of my code queries vs GPT4. GPT4 and Bard and Bing handle file uploads differently. Llama2 is surprisingly good sometimes but also hopelessly bad at others. And so on. But the answer isn&#x27;t to pick one daily driver. It&#x27;s to make it easy to just run them all at once, and swap in&#x2F;out whenever necessary.<p>(I&#x27;ve taken to calling this Mixture of Mixture of Experts, akin to the GPT4 rumors geohot dropped on our podcast <a href=""https:&#x2F;&#x2F;news.ycombinator.com&#x2F;item?id=36413296"">https:&#x2F;&#x2F;news.ycombinator.com&#x2F;item?id=36413296</a>)<p>As the app grew in screen real estate (ultrawide monitor people! this is your calling!) and I started needing to copy&#x2F;paste things more, I realized what we were really building was a full-fledged <i>secondary browser</i> that does a slightly different job than your regular browser. It&#x27;s nominal first purpose is to just harmonize all chat inputs, but more broadly, I can pipe any arbitrary input to any open&#x2F;closed LLM <i>without any api key</i> using your own account, and use it to enhance your browsing experience generally without me ever seeing your data. What could you do if you could add intelligence features for ~free to any part of your browsing experience? MS Edge has shown a bit of this potential but why should we be limited to just the Edge browser, or just the sidebar? (you can see the beginnings of our thinking in the alpha PromptCritic feature we just added).<p>You can see our 1min launch video here: <a href=""https:&#x2F;&#x2F;twitter.com&#x2F;swyx&#x2F;status&#x2F;1692988634364871032"" rel=""nofollow noreferrer"">https:&#x2F;&#x2F;twitter.com&#x2F;swyx&#x2F;status&#x2F;1692988634364871032</a><p>We&#x27;ve been hacking on this as a side project, and it&#x27;s my first ever Electron app using a bunch of gnarly features. The UX has a lot of things to improve (see the open issues... help!) but just wanted to get this out there.<p>Feedback welcome!",1692548757,2023-08-20 16:25:57 UTC,Show HN: GodMode – open-source AI Chat Browser,story,https://github.com/smol-ai/GodMode,20/8/2023 16:25,431,133,102,57,53,35,18,6,1,0,0,0,17,6,2,0,1,0,28,11,7,8,6,6,4,1,2,0,1,0
kevinlu1248,,37202950,1,,1692565732,2023-08-20 21:08:52 UTC,Codeblocks: Library for merging incomplete LLM-generated code,story,https://github.com/aorwall/codeblocks,20/8/2023 21:08,2,0,0,0,0,0,6,0,0,0,0,0,2,0,0,0,0,0,0,0,0,0,0,0,1,0,0,0,0,0
gharbat,,37203196,128,,1692567919,2023-08-20 21:45:19 UTC,OpenCopilot – Open source AI copilot for your own SaaS product,story,https://github.com/openchatai/OpenCopilot,20/8/2023 21:45,912,301,199,764,636,126,154,108,232,477,247,126,56,80,145,220,192,104,60,18,19,60,62,20,5,4,6,5,5,6
ricklamers,,37207242,2,"Hello HN! I know this project is a super simple wrapper around LangChain&#x2F;OpenAI but I just found myself wanting this badly myself: a super simple `pip install` package that I can use to get command suggestions within the terminal as I&#x27;m being productive doing other things.<p>Example usage:<p>`shai git diff but without the big json blobs`<p>`shai &#x27;copy everything in data&#x2F; via ssh to $SSH_HOST using scp&#x27;`<p>The implementation is literally one short glue of LangChain and InquirerPy for interactive CLI.<p>I&#x27;m curious which ideas you all have to make this smarter&#x2F;better. MIT licensed, if you&#x27;re keen on contributing please feel free to do so. It&#x27;s a pure hobby project for me.<p>Some key objectives: never automatically run shell code, I want to see what I run before I run it, present me with some alternatives, a simple path to using local models in the future (Llama 2 Code soon?).<p>Will add I was inspired by the great <a href=""https:&#x2F;&#x2F;github.com&#x2F;gorilla-llm&#x2F;gorilla-cli"">https:&#x2F;&#x2F;github.com&#x2F;gorilla-llm&#x2F;gorilla-cli</a> project, but didn&#x27;t like that it sends the prompt to some IP based endpoint the author presumably runs.",1692610873,2023-08-21 09:41:13 UTC,"Show HN: Shell-AI, run shell commands with natural language",story,https://github.com/ricklamers/shell-ai,21/8/2023 9:41,112,22,18,13,16,15,8,0,1,7,1,0,2,0,2,4,2,0,14,2,2,2,4,0,1,0,2,2,2,0
rishsriv,,37209539,5,,1692625719,2023-08-21 13:48:39 UTC,SQLCoder: 15B param OSS LLM that outperforms GPT-3.5 for text to SQL generation,story,https://github.com/defog-ai/sqlcoder,21/8/2023 13:48,187,174,309,92,179,273,3,6,6,0,4,30,0,2,2,1,2,2,17,9,16,9,7,27,1,2,2,1,3,1
haouarin,,37220069,11,,1692693307,2023-08-22 08:35:07 UTC,Show HN: Convert Research Papers into Dynamic Mind Maps with Claude,story,https://github.com/nhaouari/papersnap,22/8/2023 8:35,16,5,1,2,1,0,1,0,0,0,0,0,0,0,0,0,0,0,0,1,0,0,0,0,1,0,0,0,0,0
jawerty,,37220201,2,,1692694650,2023-08-22 08:57:30 UTC,"Show HN: 10x-Git-Buddy, an LLM Agent That Fixes GitHub Issues for You",story,https://github.com/jawerty/10x-Git-Buddy,22/8/2023 8:57,0,0,1,0,0,0,0,0,0,0,0,0,0,0,0,0,0,0,0,0,0,0,0,0,0,0,0,0,0,0
JohannesTk,,37223776,109,"Hey HN<p>OpenCopilot is an OSS framework which helps devs to build open-source AI Copilots that actually work and embed into their product with ease.<p>Why another LLM framework?<p>Twitter is full of impressive LLM applications but once you peel off the curtains it’s clear that they are just demos. The reason being because building an AI Copilot that goes beyond a Twitter demo can be complex, time-consuming and unreliable.<p>Our team has been in the AI space since 2018 and built numerous LLM apps &amp; copilots. While doing that, we got approached by many startups saying they’d also like to build a copilot for their product but they haven’t been able to get it reliable, fast or cost-effective enough for production use. Thus we built OpenCopilot framework, so devs can intuitively get AI Copilots running in less than 10 minutes and iterate towards a useful Copilot in a single day.<p>We believe every product, company and individual will have their Copilot in the future. Thus, we’d love your feedback, questions and constructive criticism.",1692716629,2023-08-22 15:03:49 UTC,Show HN: OpenCopilot – Build and embed open-source AI copilots into your product,story,https://github.com/opencopilotdev/opencopilot,22/8/2023 15:03,87,17,0,0,0,0,274,0,0,0,0,0,140,0,0,0,0,0,2,0,0,0,0,0,5,0,0,0,0,0
youyang8,,37224725,5,,1692720483,2023-08-22 16:08:03 UTC,Show HN: Open-Source Chat AI Platform with Custom Knowledge,story,https://github.com/RCGAI/SimplyRetrieve,22/8/2023 16:08,13,24,15,11,6,4,0,8,6,5,0,6,0,0,0,0,0,0,0,3,3,0,0,0,0,1,2,1,0,1
vyrotek,,37229057,1,,1692741320,2023-08-22 21:55:20 UTC,Whisper.NET – .NET Bindings for OpenAI Whisper,story,https://github.com/sandrohanea/whisper.net,22/8/2023 21:55,20,20,31,27,31,28,12,0,16,0,0,3,15,11,19,2,3,7,5,1,4,4,2,4,2,1,3,1,1,2
wenyuanyu,,37232342,2,,1692770505,2023-08-23 06:01:45 UTC,"Qwen-VL, a Large Vision Language Model by Alibaba Cloud",story,https://github.com/QwenLM/Qwen-VL,23/8/2023 6:01,449,272,235,248,446,391,30,21,3,20,7,0,20,3,2,3,6,2,36,26,16,20,36,32,8,4,4,3,3,2
