by,dead,discussion_id,score,text,time,timestamp,title,type,url,date,stars_at_submission,stars_month_1,stars_month_2,stars_month_3,stars_month_4,stars_month_5,commits_at_submission,commits_month_1,commits_month_2,commits_month_3,commits_month_4,commits_month_5,pull_requests_at_submission,pull_requests_month_1,pull_requests_month_2,pull_requests_month_3,pull_requests_month_4,pull_requests_month_5,forks_at_submission,forks_month_1,forks_month_2,forks_month_3,forks_month_4,forks_month_5,contributors_at_submission,contributors_month_1,contributors_month_2,contributors_month_3,contributors_month_4,contributors_month_5
happycry,,38641748,3,,1702564517,2023-12-14 14:35:17 UTC,Open source speech denoising and enhancement AI Model,story,https://github.com/resemble-ai/resemble-enhance,14/12/2023 14:35,389,236,57,125,66,59,7,2,2,0,0,1,0,0,0,0,0,1,29,24,6,8,8,6,2,1,1,0,0,2
jcater,,38643189,2,,1702571557,2023-12-14 16:32:37 UTC,Pearl – A Production-Ready Reinforcement Learning AI Agent Library by Meta,story,https://github.com/facebookresearch/Pearl,14/12/2023 16:32,1773,161,121,49,44,32,18,22,37,25,58,8,13,20,17,0,9,5,102,10,4,6,10,7,9,6,5,3,4,3
jamesmurdza,,38643896,1,,1702574006,2023-12-14 17:13:26 UTC,Call every LLM API with curl or Python,story,https://github.com/jamesmurdza/llm-api-examples,14/12/2023 17:13,7,2,0,1,0,0,38,0,2,0,0,0,0,0,0,0,0,0,0,0,0,1,0,0,2,0,2,0,0,0
transitivebs,,38645421,15,,1702579874,2023-12-14 18:51:14 UTC,Use Coffee to iterate on your frontend using AI,story,https://github.com/Coframe/coffee,14/12/2023 18:51,1099,130,48,31,10,29,25,4,0,0,0,1,28,4,1,0,0,1,43,8,6,3,0,0,5,2,1,0,0,1
tosh,,38647796,8,,1702590670,2023-12-14 21:51:10 UTC,Medprompt+: GPT-4 vs. Gemini Ultra,story,https://github.com/microsoft/promptbase,14/12/2023 21:51,4125,338,132,263,76,110,69,149,0,0,30,12,21,44,0,0,2,2,249,18,6,15,6,8,4,2,0,0,1,1
?.?.-11,,38648564,3,,1702594683,2023-12-14 22:58:03 UTC,"App for self hosted LLMs (llama, mistral, vicuna)",story,https://github.com/AugustDev/enchanted,14/12/2023 22:58,110,177,384,355,435,374,11,9,32,13,26,26,8,2,7,12,17,24,8,16,27,18,24,26,1,1,1,2,2,3
tosh,,38653416,1,,1702642843,2023-12-15 12:20:43 UTC,LLM-Mistral,story,https://github.com/simonw/llm-mistral,15/12/2023 12:20,73,13,24,8,2,0,7,0,3,0,4,0,0,1,1,0,0,0,5,3,0,0,1,0,1,1,1,0,1,0
rohanphadte,,38657953,1,,1702669546,2023-12-15 19:45:46 UTC,"Codeium, a free AI Code autocomplete tool, open sources Visual Studio Extension",story,https://github.com/Exafunction/CodeiumVisualStudio,15/12/2023 19:45,35,13,4,19,14,20,32,3,4,8,1,3,43,3,3,8,3,3,5,5,3,2,1,4,3,3,1,1,2,2
foxhop,,38664164,4,,1702734621,2023-12-16 13:50:21 UTC,"Show HN: Alternative Front End to GPT, Claude, or Mistral Flask/Socketio",story,https://github.com/russellballestrini/flask-socketio-llm-completions,16/12/2023 13:50,3,3,4,1,2,1,11,11,5,7,6,3,0,0,0,0,0,0,0,0,0,0,1,0,1,1,1,1,1,1
kugurerdem,,38664793,1,"I&#x27;ve just created a simple bash script for personal use that makes it easier to interact with ChatGPT through VIM.<p>Essentially, the script uses SimonW&#x27;s superb client llm[0], and vipe[1].<p>[0]: <a href=""https:&#x2F;&#x2F;github.com&#x2F;simonw&#x2F;llm"">https:&#x2F;&#x2F;github.com&#x2F;simonw&#x2F;llm</a><p>[1]: <a href=""https:&#x2F;&#x2F;joeyh.name&#x2F;code&#x2F;moreutils&#x2F;"" rel=""nofollow noreferrer"">https:&#x2F;&#x2F;joeyh.name&#x2F;code&#x2F;moreutils&#x2F;</a>",1702739691,2023-12-16 15:14:51 UTC,Show HN: Simple Script for Enhanced LLM Interaction in Vim,story,https://github.com/kugurerdem/vi-llm,16/12/2023 15:14,0,0,0,0,0,0,0,0,0,0,0,0,0,0,0,0,0,0,0,0,0,0,0,0,0,0,0,0,0,0
wrdsmsh321,,38668384,3,,1702765977,2023-12-16 22:32:57 UTC,Large New Dataset 220k AI Art Text to Image Prompts,story,https://github.com/lee101/artificial-intelligence-art,16/12/2023 22:32,0,0,0,0,0,0,0,0,0,0,0,0,0,0,0,0,0,0,0,0,0,0,0,0,0,0,0,0,0,0
vincent_s,,38672497,2,,1702817109,2023-12-17 12:45:09 UTC,"Easy, fast, and cheap LLM serving for everyone",story,https://github.com/vllm-project/vllm,17/12/2023 12:45,1616,1206,1498,1751,1751,1489,117,151,311,265,265,289,263,297,568,572,572,594,268,214,312,321,321,278,83,91,124,125,125,117
Shimoku,,38674931,2,,1702836734,2023-12-17 18:12:14 UTC,Shimoku: Revolutionize AI App Development with Pure Python,story,https://github.com/shimoku-tech/shimoku-api-python,17/12/2023 18:12,2,2,2,2,2,1,23,57,31,35,35,14,4,14,7,5,5,2,0,0,0,0,0,0,2,1,2,2,2,3
ulrischa,,38675596,1,,1702841306,2023-12-17 19:28:26 UTC,OpenAI/Weak-to-Strong,story,https://github.com/openai/weak-to-strong,17/12/2023 19:28,147,68,60,51,51,28,3,0,0,0,0,0,12,4,0,1,1,7,23,18,9,7,7,4,5,3,0,1,1,4
MaryCsb,,38681058,12,,1702896609,2023-12-18 10:50:09 UTC,"An AI tuner for guitar, ukulele, bass and etc.",story,https://github.com/FastTune/FastTune,18/12/2023 10:50,2,1,0,1,0,0,0,0,0,0,0,0,0,0,0,0,0,0,0,0,0,0,0,0,0,0,0,0,0,0
Alyx1337,,38682095,83,,1702906055,2023-12-18 13:27:35 UTC,"Jarvis: A Voice Virtual Assistant in Python (OpenAI, ElevenLabs, Deepgram)",story,https://github.com/AlexandreSajus/JARVIS,18/12/2023 13:27,51,33,34,37,19,11,0,0,0,0,0,0,0,0,0,0,0,0,14,15,18,13,6,6,0,0,0,0,0,0
rjkeck2,,38689024,2,,1702937192,2023-12-18 22:06:32 UTC,Show HN: Golang client library for Mistral AI platform,story,https://github.com/robertjkeck2/mistral-go,18/12/2023 22:06,1,1,0,0,0,0,2,0,0,0,0,0,4,0,1,0,0,0,2,0,1,0,0,0,2,0,1,0,0,0
hubraumhugo,,38692694,3,,1702969122,2023-12-19 06:58:42 UTC,The Java Spring AI Project,story,https://github.com/spring-projects/spring-ai,19/12/2023 6:58,331,172,227,610,217,234,74,133,107,90,119,110,58,80,129,111,129,178,58,49,81,130,78,71,24,21,38,35,43,48
_false,,38693876,3,,1702980892,2023-12-19 10:14:52 UTC,Openlogprobs: Extract full next-token probabilities via language model APIs,story,https://github.com/justinchiu/openlogprobs,19/12/2023 10:14,64,1,21,14,4,1,1,0,0,0,0,0,1,1,0,0,0,0,5,1,3,0,0,1,1,1,0,0,0,0
dataminer,,38708585,417,,1703079968,2023-12-20 13:46:08 UTC,High-Speed Large Language Model Serving on PCs with Consumer-Grade GPUs,story,https://github.com/SJTU-IPADS/PowerInfer,20/12/2023 13:46,691,145,226,143,74,549,22,9,37,13,1,6,20,8,11,6,2,7,51,9,14,11,9,26,5,3,3,2,2,3
pama,,38719675,2,,1703162140,2023-12-21 12:35:40 UTC,Building blocks for AI systems: links to modern state space model research,story,https://github.com/HazyResearch/aisys-building-blocks,21/12/2023 12:35,53,14,20,11,17,9,1,0,0,0,0,0,0,0,0,0,0,0,4,1,2,1,0,0,1,0,0,0,0,0
tosh,,38725700,3,,1703187714,2023-12-21 19:41:54 UTC,Llama-Terminal-Completion,story,https://github.com/adammpkins/llama-terminal-completion,21/12/2023 19:41,7,3,3,3,3,2,0,0,0,0,0,0,0,0,1,0,0,0,2,0,1,1,2,0,0,0,1,0,0,0
hsluoyz,,38730790,80,,1703217557,2023-12-22 03:59:17 UTC,Open-source AI knowledge database with web UI and Enterprise SSO,story,https://github.com/casibase/casibase,22/12/2023 3:59,68,41,299,206,166,134,11,16,134,43,28,73,16,29,49,20,30,66,4,4,35,16,16,16,3,3,6,4,6,8
radhakrsna,,38733891,15,"Hi HN,<p>Today, we are excited to be open-sourcing GPTRouter, an LLMOps tool we have been using internally at Writesonic for handling millions of monthly requests for our users.<p>Universal API for 30+ LLMs, Vision and Image Models  Smart Fallbacks based on latency and uptime  Automatic Retries  Supports streaming<p>Since embracing OpenAI GPT-3 in production in 2020, we at Writesonic have been serving millions of users and faced the typical scaling pains with generative AI models:<p>1. Dependency on a single model risked total downtime. 2. Latency issues with models like GPT-4 affected user experience. 3. Integrating various models was tough due to different APIs and SDKs.<p>Early this year at Writesonic, we set out with a clear vision: to become model agnostic.<p>Faced with single-model limitations and diverse AI challenges, we began building GPTRouter - our bespoke solution to navigate and thrive in a multi-model AI world.<p>With GPTRouter&#x27;s Universal API, you&#x27;re the master of AI models. Swap between OpenAI, Azure, Anthropic, Replicate, Cohere &amp; more with just one line of code. It simplifies model management to a great extent.<p>Downtime isn&#x27;t an option. GPTRouter&#x27;s Smart Fallbacks mean your service is always on. You can define a hierarchy of models for each use case. GPTRouter will constantly check for uptime&#x2F;downtime, latency and other factors, and automatically fallback to the next best model with zero interruption.<p>Say goodbye to manual retries. GPTRouter does the heavy lifting with Automatic Retries for failed requests, keeping your AI services sharp and consistent.<p>GPTRouter&#x27;s Edge:  Universal API for seamless model switching.  Smart, automatic fallbacks for continuous service.  Reduced latencies for quick interactions.<p>Additionally, we will also be open sourcing our frontend LLMOps layer that provides a playground to test multiple models in parallel, keep a tab on the latencies for each model, track tokens and costs for each model and user all in one place.<p>We are looking forward to seeing how developers leverage GPTRouter in their own use cases.<p>Thank you!",1703251472,2023-12-22 13:24:32 UTC,"Show HN: GPT Router – Open-Source API Gateway for LLMs (OpenAI, Anthropic, etc.)",story,https://github.com/Writesonic/GPTRouter,22/12/2023 13:24,42,16,19,23,11,9,0,0,0,0,0,0,0,1,4,0,0,0,3,0,1,0,3,0,0,1,1,0,0,0
natbarling,,38739183,5,,1703282487,2023-12-22 22:01:27 UTC,"Show HN: Sunlight, use an LLM to debias your content",story,https://github.com/a16z-infra/sunlight,22/12/2023 22:01,1,9,2,4,1,2,0,0,0,0,0,0,0,0,0,0,0,0,0,0,0,0,1,0,0,0,0,0,0,0
enochyearn,,38741501,2,,1703303948,2023-12-23 03:59:08 UTC,RoBERTa and MLX = NLP on Your iPhone,story,https://github.com/enochyearn/MLX_RoBERTa,23/12/2023 3:59,2,0,0,0,0,0,0,0,0,0,0,0,0,0,0,0,0,0,0,0,0,0,0,0,0,0,0,0,0,0
eddieweng,,38743919,2,,1703336246,2023-12-23 12:57:26 UTC,Animediff – turn images into videos by AI,story,https://github.com/guoyww/AnimateDiff,23/12/2023 12:57,658,477,499,360,353,489,0,4,0,0,0,0,0,1,0,3,0,2,49,44,47,40,37,37,0,2,0,3,0,2
weirdcat,,38745348,621,,1703348389,2023-12-23 16:19:49 UTC,Ferret: A Multimodal Large Language Model,story,https://github.com/apple/ml-ferret,23/12/2023 16:19,1731,296,147,216,150,235,0,0,0,0,0,0,7,0,1,0,0,0,135,24,28,19,16,9,5,0,1,0,0,0
PaulHoule,,38749435,5,,1703374979,2023-12-23 23:42:59 UTC,Medusa: Framework for Accelerating LLM Generation with Multiple Decoding Heads,story,https://github.com/FasterDecoding/Medusa,23/12/2023 23:42,256,121,120,79,69,57,6,0,0,1,0,0,5,3,0,2,2,1,11,13,15,9,5,4,2,3,0,2,2,1
vignesh_warar,,38758592,3,,1703465936,2023-12-25 00:58:56 UTC,AI Employe: An Open-Source Alternative to Adept.ai,story,https://github.com/vignshwarar/AI-Employe,25/12/2023 0:58,138,20,28,17,14,8,4,1,0,0,0,0,0,0,0,0,0,0,14,2,3,1,3,1,1,1,0,0,0,0
copetime,,38760518,2,,1703488397,2023-12-25 07:13:17 UTC,A script to set up Google gemini on telegram bot using vercel,story,https://github.com/winniesi/tg-gemini-bot,25/12/2023 7:13,15,9,14,8,10,5,15,1,1,0,0,0,3,2,1,0,0,0,7,13,18,5,9,3,1,2,1,0,0,0
tslmy,,38764594,2,,1703527073,2023-12-25 17:57:53 UTC,Llama Lab: Ambitious projects built on top of LlamaIndex,story,https://github.com/run-llama/llama-lab,25/12/2023 17:57,59,45,44,31,31,11,0,0,0,0,0,0,0,0,0,0,0,0,5,1,4,2,3,1,0,0,0,0,0,0
graphitout,,38770823,20,"Lately, I&#x27;ve been tinkering with llama.cpp and the ollama server. The speed of these tools caught my attention, even on my modest 4060 setup. I was quite impressed with the generation quality of models like Mistral.<p>But I was a bit unhappy at the same time because whenever I explore a topic, there is a lot of typing involved when using the chat interface. So I needed a tool to not only give a response but also generate a set of &quot;suggestions&quot; which can be explored further just by clicking.<p>My experience in front-end development is limited. Nonetheless, I tinkered together a small web app to achieve the same goal. It is built with vuejs3+vuetify.<p>Code: <a href=""https:&#x2F;&#x2F;github.com&#x2F;charstorm&#x2F;llmbinge&#x2F;"">https:&#x2F;&#x2F;github.com&#x2F;charstorm&#x2F;llmbinge&#x2F;</a>",1703590027,2023-12-26 11:27:07 UTC,Show HN: A web-app to explore topics using LLM,story,https://github.com/charstorm/llmbinge,26/12/2023 11:27,5,0,1,0,1,0,6,0,0,0,0,0,0,0,0,0,0,0,0,0,0,0,0,0,1,0,0,0,0,0
xsigoking,,38771073,3,,1703592268,2023-12-26 12:04:28 UTC,"Aichat: Use GPT-4(V), Gemini, LocalAI, Ollama and Other LLMs in the Terminal",story,https://github.com/sigoden/aichat,26/12/2023 12:04,180,131,242,295,208,217,6,23,66,196,105,117,8,21,71,128,107,168,12,4,13,20,7,18,2,2,5,3,6,4
muttled,,38775374,3,I was running into an issue with a vLLM bug that affected multiple GPUs and I needed a stand-in while that bug was getting fixed that used the same API format but had better performance than the API on text-generation-webui. It&#x27;s very rough. I&#x27;m not a coder by trade. But it&#x27;s very fast once you have many simultaneous connections.,1703620326,2023-12-26 19:52:06 UTC,Show HN: Made a batching LLM API for a project. Mistral 200 tk/s on RTX 3090,story,https://github.com/epolewski/EricLLM,26/12/2023 19:52,25,16,10,15,5,6,9,0,3,2,0,0,0,0,0,0,0,0,3,2,0,2,0,0,1,0,1,1,0,0
illgenr,,38777171,1,,1703633032,2023-12-26 23:23:52 UTC,An Emacs Porcelain for LLM,story,https://github.com/illgenr/llm,26/12/2023 23:23,3,0,0,0,0,0,0,0,0,0,0,0,0,0,0,0,0,0,0,0,0,0,0,0,0,0,0,0,0,0
keepamovin,,38783583,1,,1703694737,2023-12-27 16:32:17 UTC,ChatGPT-TUI Terminal-based user interface for ChatGPT,story,https://github.com/narinluangrath/chatgpt-tui,27/12/2023 16:32,1,0,0,0,0,0,0,0,0,0,0,0,0,0,0,0,0,0,0,0,0,0,0,0,0,0,0,0,0,0
shidayat,,38790243,1,"Most of the python bot libraries come with a router, but to fit my criteria (route&#x2F;command group, etc.) I created my own router and its easy to integrate with any chatbot library.",1703739912,2023-12-28 05:05:12 UTC,Show HN: Chatrouter – Python Router for Chatbot,story,https://github.com/cirebon-dev/chatrouter,28/12/2023 5:05,0,0,0,0,0,0,7,2,0,0,0,0,6,4,0,0,0,0,0,0,0,0,0,0,1,1,0,0,0,0
daavidhauser,,38792941,1,,1703767719,2023-12-28 12:48:39 UTC,Create an AI clone of yourself (Code and tutorial),story,https://github.com/kinggongzilla/ai-clone-whatsapp,28/12/2023 12:48,38,8,12,46,24,11,1,0,1,14,0,2,0,0,0,0,0,0,5,2,5,2,5,2,1,0,1,1,0,1
cleverbit,,38799712,1,,1703803620,2023-12-28 22:47:00 UTC,GPT helped me build a Python tool to work with the OpenAI Assistants API,story,https://github.com/richarddas/OpenAI-Python-Tools,28/12/2023 22:47,0,0,1,0,0,0,0,0,0,0,0,0,0,0,0,0,0,0,0,0,1,0,0,0,0,0,0,0,0,0
_andrei_,,38805137,1,,1703859655,2023-12-29 14:20:55 UTC,Show HN: PromptPack – interactive CLI tool to pack files into an LLM prompt,story,https://github.com/3rd/promptpack,29/12/2023 14:20,1,0,0,0,3,0,0,0,0,0,0,0,0,0,0,0,0,0,0,0,0,0,0,0,0,0,0,0,0,0
radq,,38812198,9,"I&#x27;ve been working on training this small vision language model for the last month - excited to release the first prototype today! It is based on SigLIP (image encoder), Phi-1.5 (text model) and trained using the LLaVa-1.5 training dataset.<p>It runs reasonably fast on CPU with ~8GB of RAM in full 32-bit precision. There&#x27;s plenty of room to speed it up and reduce memory consumption by quantizing the model.<p>I posted a video of it running on my M2 Macbook Air (on CPU not MPS, so performance should be comparable on other hardware) on Twitter to demonstrate inference speed: <a href=""https:&#x2F;&#x2F;twitter.com&#x2F;vikhyatk&#x2F;status&#x2F;1740910503323734448"" rel=""nofollow"">https:&#x2F;&#x2F;twitter.com&#x2F;vikhyatk&#x2F;status&#x2F;1740910503323734448</a>",1703900947,2023-12-30 01:49:07 UTC,"Show HN: Moondream, a small vision language model that runs on 8GB of RAM",story,https://github.com/vikhyat/moondream,30/12/2023 1:49,1173,708,1128,370,433,322,27,2,36,11,7,9,15,1,0,4,4,1,84,61,117,39,37,17,9,2,2,4,4,2
andy99,,38819214,1,,1703970800,2023-12-30 21:13:20 UTC,Guardrails AI,story,https://github.com/guardrails-ai/guardrails,30/12/2023 21:13,128,203,189,142,136,132,55,149,173,85,185,368,35,67,120,46,62,82,15,10,28,7,10,15,8,10,12,9,9,13
ziptron,,38821337,2,,1703991169,2023-12-31 02:52:49 UTC,GPT Video – Reproducing the Gemini Demo Using GPT 4 Vision,story,https://github.com/jide/gpt-video,31/12/2023 2:52,26,6,3,2,1,1,0,0,0,0,0,0,0,0,0,0,0,0,7,4,4,0,4,1,0,0,0,0,0,0
yla92,,38822164,377,,1704002351,2023-12-31 05:59:11 UTC,Emacs-copilot: Large language model code completion for Emacs,story,https://github.com/jart/emacs-copilot,31/12/2023 5:59,281,27,16,23,24,11,1,0,0,0,0,0,1,0,0,0,0,0,8,1,0,3,2,0,2,0,0,0,0,0
aiNohY6g,,38825378,1,,1704041544,2023-12-31 16:52:24 UTC,Gp.nvim: Neovim plugin ChatGPT text/code operations and Speech to text,story,https://github.com/Robitx/gp.nvim,31/12/2023 16:52,109,43,53,38,37,39,25,12,5,0,3,0,9,4,1,3,3,1,9,2,4,4,3,4,5,4,2,3,1,1
RonanOD,,38827769,3,,1704059080,2023-12-31 21:44:40 UTC,AI Assisted Open Source App for Autism,story,https://github.com/RonanOD/OpenAAC,31/12/2023 21:44,9,6,1,4,0,1,24,21,1,5,6,2,12,34,2,2,10,4,2,0,0,2,0,0,2,2,1,2,2,2
ctur,,38828231,6,,1704063227,2023-12-31 22:53:47 UTC,Gptel: A simple LLM client for Emacs,story,https://github.com/karthink/gptel,31/12/2023 22:53,90,63,98,61,57,61,38,23,63,19,15,28,4,11,8,12,13,6,10,9,4,14,8,6,4,7,6,7,7,3
TheIronYuppie,,38835526,1,,1704144645,2024-01-01 21:30:45 UTC,`catgpt` is a command-line tool that uses the OpenAI model to generate text,story,https://github.com/ibuildthecloud/catgpt,1/1/2024 21:30,85,5,0,0,0,0,6,1,0,0,0,0,0,0,0,0,0,0,3,0,0,0,0,0,1,1,0,0,0,0
wangyaozhi,,38840844,1,,1704197776,2024-01-02 12:16:16 UTC,Show HN: A Chrome Extension to Get Personal 2023 ChatGPT Interaction Review,story,https://github.com/yaozhiwang/chatgpt-sugar,2/1/2024 12:16,4,1,1,0,0,0,13,1,0,0,0,0,0,0,0,0,0,0,0,0,0,0,0,0,1,1,0,0,0,0
wslh,,38843465,1,,1704213073,2024-01-02 16:31:13 UTC,NeuroEngine allows users to share their LLM creations with others,story,https://github.com/ortegaalfredo/neuroengine,2/1/2024 16:31,5,4,1,2,0,0,3,3,0,0,0,0,0,0,0,0,0,0,0,0,0,0,0,0,1,1,0,0,0,0
redactai,,38843634,2,,1704213824,2024-01-02 16:43:44 UTC,Show HN: I built a private way to interact with LLM APIs using your documents,story,https://github.com/itsliamdowd/Redact,2/1/2024 16:43,10,1,1,0,0,0,8,0,0,0,0,0,0,0,0,0,0,0,0,0,0,0,0,0,1,0,0,0,0,0
AaronFriel,,38845892,2,,1704223793,2024-01-02 19:29:53 UTC,"Fn-stream (JS Library) – Create AI applications with streaming, structured LLMs",story,https://github.com/AaronFriel/fn-stream,2/1/2024 19:29,10,4,5,1,0,1,9,0,0,0,0,0,0,0,0,0,0,0,0,0,0,0,0,0,1,0,0,0,0,0
rjmacarthy,,38853495,4,,1704286458,2024-01-03 12:54:18 UTC,"Ollama AI code completion plugin for VSCode, 100% free and 100% private",story,https://github.com/rjmacarthy/twinny,3/1/2024 12:54,192,328,285,533,286,338,186,222,108,78,24,0,48,68,39,14,3,0,7,25,18,24,12,19,3,9,6,3,2,0
T-A,,38859749,237,,1704315230,2024-01-03 20:53:50 UTC,TinyGPT-V: Efficient Multimodal Large Language Model via Small Backbones,story,https://github.com/DLYuanGod/TinyGPT-V,3/1/2024 20:53,903,34,36,27,26,20,22,0,1,2,0,0,0,0,0,0,0,0,46,6,7,1,1,2,2,0,1,1,0,0
skywarth,,38871273,1,,1704397177,2024-01-04 19:39:37 UTC,OpenAI API Status Prober for Prometheus Blackbox,story,https://github.com/skywarth/openai-api-status-prober,4/1/2024 19:39,1,0,0,0,0,1,0,0,0,0,0,0,0,0,0,0,0,0,0,0,0,0,0,0,0,0,0,0,0,0
neelkumar54,,38871957,1,,1704400885,2024-01-04 20:41:25 UTC,Automate Your iOS Localization with AI,story,https://github.com/kumarneel/SwiftLingo,4/1/2024 20:41,5,1,0,0,0,0,12,0,0,0,0,0,2,0,0,0,0,0,0,0,0,0,0,0,1,0,0,0,0,0
md5sha256,,38897408,2,,1704590589,2024-01-07 01:23:09 UTC,Show HN: AI Wrapped,story,https://github.com/kunaljaydesai/ai-wrapped,7/1/2024 1:23,1,0,0,0,0,0,4,0,0,0,0,0,0,0,0,0,0,0,0,0,0,0,0,0,1,0,0,0,0,0
gavi,,38898798,4,,1704605936,2024-01-07 05:38:56 UTC,Fine-Tuning Mistral 7B with WhatsApp Chats – A Practical MLX Project,story,https://github.com/gavi/mlx-whatsapp,7/1/2024 5:38,133,4,2,2,0,2,6,0,0,0,0,0,2,0,0,0,0,0,11,0,0,0,0,1,2,0,0,0,0,0
ulrischa,,38904970,5,,1704660351,2024-01-07 20:45:51 UTC,"CrewAI: Framework for orchestrating role-playing, autonomous AI agents",story,https://github.com/joaomdmoura/crewAI,7/1/2024 20:45,5235,2068,2204,2191,2003,1416,104,94,92,96,153,125,70,39,71,65,105,67,546,299,376,354,319,243,27,23,31,29,34,29
tosh,,38905417,3,,1704663574,2024-01-07 21:39:34 UTC,SelfExtend Attention for Mistral,story,https://github.com/sdan/selfextend,7/1/2024 21:39,101,2,6,4,2,1,4,0,0,0,0,0,0,0,0,0,0,0,2,0,0,0,0,0,1,0,0,0,0,0
billyzee,,38909249,4,,1704700248,2024-01-08 07:50:48 UTC,Show HN: YouTube Summarization Chatbot,story,https://github.com/itsBIllyZee/YTChatBot,8/1/2024 7:50,2,0,0,0,0,0,8,0,0,0,0,0,0,0,0,0,0,0,0,0,0,0,0,0,1,0,0,0,0,0
roh26it,,38911677,37,"We are Rohit &amp; Ayush, we created Portkey this year March to help tackle some challenges we had seen while building apps based on GPT3, 3.5, 4, and the DevOps principles we brought to the scene to help tackle them.<p>We believe, a solid, performant, and reliable gateway lays the foundation to help build the next level of LLM apps. It decreases excessive reliance on any one company and takes the focus back to building instead of spending time fixing the nitty gritties of different providers and making them work together.<p>Features:<p><pre><code>  Blazing fast (9.9x faster) with a tiny footprint (~45kb installed)   Load balance across multiple models, providers, and keys   Fallbacks make sure your app stays resilient   Automatic Retries with exponential fallbacks come by default   Plug-in middleware as needed   Battle tested over 100B tokens and millions of requests </code></pre> For the folks serious about gateway, separation of concerns, TS developers.. I&#x27;d love to hear your thoughts and we&#x27;re hungry for feedback!<p>Reach out to us at hello@portkey.ai or explore the project: <a href=""https:&#x2F;&#x2F;github.com&#x2F;portkey-ai&#x2F;gateway"">https:&#x2F;&#x2F;github.com&#x2F;portkey-ai&#x2F;gateway</a>",1704720909,2024-01-08 13:35:09 UTC,"Show HN: A lightweight AI gateway to 100+ models, in TS",story,https://github.com/Portkey-AI/gateway,8/1/2024 13:35,3073,343,545,257,325,229,58,61,56,47,47,19,59,39,44,34,47,31,162,29,55,37,35,27,9,7,9,11,9,9
cbracketdash,,38918363,2,,1704749030,2024-01-08 21:23:50 UTC,Accessible AI for Everyone,story,https://github.com/Significant-Gravitas/AutoGPT,8/1/2024 21:23,1850,1535,2224,1678,1509,1195,63,141,167,122,252,341,378,257,181,75,76,192,1320,1173,1435,1140,1037,758,80,109,53,25,16,18
tosh,,38925728,1,,1704805661,2024-01-09 13:07:41 UTC,Chatbot UI 2.0,story,https://github.com/mckaywrigley/chatbot-ui,9/1/2024 13:07,4027,911,872,604,627,436,160,51,31,8,6,8,225,59,87,46,27,25,819,382,391,247,253,165,34,23,21,21,15,11
todsacerdoti,,38925802,146,,1704806160,2024-01-09 13:16:00 UTC,"AI Toolkit: Give a brain to your game's NPCs, a header-only C++ library",story,https://github.com/linkdd/aitoolkit,9/1/2024 13:16,376,17,11,6,4,8,38,0,0,0,7,0,4,0,0,0,2,0,17,2,2,0,1,2,3,0,0,0,3,0
dlojudice,,38926307,5,"Hi HN! I just released assistant-tui, a terminal user interface for OpenAI&#x27;s Assistant API.<p>If terminal is your thing, it can be a great way to test and evaluate the API and its results.<p>It implements not only the API, but also all the infrastructure to make it work, including polling, local repository, and more.<p>Feedbacks and stars are welcome!<p><a href=""https:&#x2F;&#x2F;github.com&#x2F;dalssoft&#x2F;assistant-tui"">https:&#x2F;&#x2F;github.com&#x2F;dalssoft&#x2F;assistant-tui</a>",1704809198,2024-01-09 14:06:38 UTC,"Show HN: Assistant-TUI, a terminal user interface for OpenAI's assistant API",story,https://github.com/dalssoft/assistant-tui,9/1/2024 14:06,17,0,1,0,0,1,0,0,0,0,0,0,0,0,0,0,0,0,0,0,0,0,0,0,0,0,0,0,0,0
tjardo,,38927477,1,"Rust&#x2F;Vue web app to interact with the OpenAI API, featuring code highlighting, message summarization and chat management.",1704815534,2024-01-09 15:52:14 UTC,Show HN: ChatGPT built in Rust + Vue,story,https://github.com/tjardoo/openai-chat,9/1/2024 15:52,3,0,0,1,0,0,3,1,0,0,0,0,2,0,0,0,0,0,0,0,0,0,0,0,2,1,0,0,0,0
robatwilliams,,38939745,2,"We built OpenAI API Functions for Excel, a developer-oriented add-in that provides =OAI.CHAT_COMPLETE() to call the completions API.<p>Think of it as a building block that lets you assemble your own tool, in the familiar and powerful spreadsheet environment, that does exactly what you need. We expect it has uses for prompt engineering, prompt decomposition, prototyping systems, and more - especially when collaborating closely with domain experts who are less comfortable in programming environments (notebooks etc.).<p>The accompanying blog post Prompt engineering with spreadsheets (<a href=""https:&#x2F;&#x2F;blog.scottlogic.com&#x2F;2024&#x2F;01&#x2F;10&#x2F;prompt-engineering-with-spreadsheets.html"" rel=""nofollow"">https:&#x2F;&#x2F;blog.scottlogic.com&#x2F;2024&#x2F;01&#x2F;10&#x2F;prompt-engineering-wi...</a>) shows example usage and explains our rationale.<p>Let us (@chrisprice and I) know what you think.",1704899594,2024-01-10 15:13:14 UTC,Show HN: Excel add-in for OpenAI prompt engineering in spreadsheets,story,https://github.com/robatwilliams/openai-excel-functions,10/1/2024 15:13,12,3,4,1,1,1,8,0,0,0,0,0,5,0,0,0,0,0,1,0,0,0,1,0,2,0,0,0,0,0
jasonjmcghee,,38940748,2,,1704906609,2024-01-10 17:10:09 UTC,Show HN: Open Source Educational Video Generator (OpenAI and FFmpeg WASM),story,https://github.com/jasonjmcghee/vlearn,10/1/2024 17:10,9,1,0,0,0,1,5,0,0,0,5,0,0,0,0,0,0,0,0,0,0,0,0,1,1,0,0,0,1,0
cvhashim04,,38940817,2,,1704907020,2024-01-10 17:17:00 UTC,ChatGPT Code Block Modal Extension,story,https://github.com/osman144/chatgpt-code-modal-extension,10/1/2024 17:17,0,1,0,0,0,0,3,0,0,0,0,0,0,0,0,0,0,0,0,0,0,0,0,0,1,0,0,0,0,0
