by,dead,discussion_id,score,text,time,timestamp,title,type,url,date,stars_at_submission,stars_month_1,stars_month_2,stars_month_3,stars_month_4,stars_month_5,commits_at_submission,commits_month_1,commits_month_2,commits_month_3,commits_month_4,commits_month_5,pull_requests_at_submission,pull_requests_month_1,pull_requests_month_2,pull_requests_month_3,pull_requests_month_4,pull_requests_month_5,forks_at_submission,forks_month_1,forks_month_2,forks_month_3,forks_month_4,forks_month_5,contributors_at_submission,contributors_month_1,contributors_month_2,contributors_month_3,contributors_month_4,contributors_month_5
pythops,,35599089,1,,1681729264,2023-04-17 11:01:04 UTC,Show HN: Tenere – ChatGPT TUI interface built in Rust,story,https://github.com/pythops/tenere,17/4/2023 11:01,13,6,1,1,7,3,0,0,1,1,14,0,0,2,2,2,2,0,1,2,2,2,0,0,0,1,2,2,1,0
Blarc,,35603737,1,,1681752196,2023-04-17 17:23:16 UTC,Show HN: AI Commits IntelliJ Plugin,story,https://github.com/Blarc/ai-commits-intellij-plugin,17/4/2023 17:23,8,11,16,8,8,4,7,19,7,1,1,8,7,27,15,6,6,15,0,1,0,1,1,2,2,4,2,2,2,2
empath-nirvana,,35604715,48,"I built this kubernetes operator as a proof of concept this weekend..  It only has a single required item in the spec, a freeform description field.  The operator will use chatgpt to generate a spec, then immediately apply it to the cluster.  It makes some attempt to correct errors if there&#x27;s a problem with the syntax.  It will leave additional comments, questions or instructions in the status field of the object.  I built this in a weekend and it&#x27;s still quite unrefined.  It&#x27;s in no way production ready, please don&#x27;t use it for anything real, but it works better than you would think, considering how simple it is.  If you&#x27;re going to use it, run it on a local cluster like &#x27;kind&#x27;.<p>Some descriptions to try:<p>* install a redis namespace with a redis cluster and a service in it * create an argocd application in the argocd namespace to install velero. * write a python script that lists all ec2 instances in us-east-1, and run it as a k8s job with the aws credentials already saved in the default namespace..<p>a somewhat longer description that also worked: given the following spec:     ---     kind: MagicHappens     apiVersion: gptmagic.io&#x2F;v1     metadata:       name: foo     spec:       description: this is a freeform description field that will be sent to chatgpt to generate kubernetes resources       dryRun: false     ---     Can you create more magic happens resources, each of which describes an argocd application that needs to be created to install a helm chart for one of the standard cluster addons that need to be installed on a cluster for it to be production ready.  The description should be be freeform text like the following: &quot;Create an argocd application in the argocd namespace to install istio from the helm chart with all the defaults&quot; or &quot;Create an argocd application in the argocd namespace to install prometheus and grafana, with an ingress enabled for grafana&quot;. Be very thorough and included as many apps that might be needed for a prod ready cluster using industry standard CNCF projects if possible.<p>(this produces a list of additional resources for the operator, which the operator then goes on to create argocd applications for -- it also left comments with instructions on one of the resources for how configure it to work with your cloud provider<p>something to note is that since you can run arbitrary containers with arbitrary commands, and chatgpt can write arbitrary code, you don&#x27;t have to limit yourself to k8s stuff.. if you&#x27;ve got saas credentials on the cluster, you can just tell it to run a python script as a job to do whatever you want.<p>Since most people are cowards, there&#x27;s a dryRun field that defaults to true, so it only attaches the spec to the object.<p>It is <i>scary</i> how well this works.",1681756762,2023-04-17 18:39:22 UTC,Show HN: Magic Happens – let ChatGPT manage your Kubernetes cluster,story,https://github.com/empath-nirvana/magic-happens,17/4/2023 18:39,7,0,0,1,1,10,0,0,0,0,0,0,0,0,0,0,0,0,0,0,0,0,0,3,0,0,0,0,0,0
chand1012,,35605073,2,,1681758431,2023-04-17 19:07:11 UTC,Convert SQL DB Schemas into a ChatGPT Prompt,story,https://github.com/chand1012/sql2gpt,17/4/2023 19:07,0,0,2,0,0,0,0,0,0,0,0,0,0,0,0,0,0,0,0,1,0,0,0,0,0,0,0,0,0,0
gkjohns,,35606373,1,,1681764280,2023-04-17 20:44:40 UTC,BabyDS – An LLM driven data science AI,story,https://github.com/Rock-River-Research/babyds,17/4/2023 20:44,9,2,6,2,2,3,0,0,0,0,0,0,0,0,0,0,0,0,1,0,1,0,0,0,0,0,0,0,0,0
42second,,35607827,2,"I built this CLI tool to fix command line errors with ChatGPT. When you hit an error on your command line, get immidiate help and fix from ChatGPT.<p>If we are familiar with what we are doing, fixing command line errors is straightforward. But there are time I face errors I never seen before. Its hard searching for answer for this kind of errors in SO or google. Sometimes the error might have many different reasons and search results shows many solutions. Many hours passed and I usually gets frustrated.<p>I feel making ChatGPT to be the initial debugger to guide whats the error means and what should I look for to fix this error.<p>I took some inspiration from this(<a href=""https:&#x2F;&#x2F;github.com&#x2F;nvbn&#x2F;thefuck"">https:&#x2F;&#x2F;github.com&#x2F;nvbn&#x2F;thefuck</a>) CLI tool I was introduced some years ago, which helps fix common errors in your cli command like misstype or need sudo. So my CLI does fetch the last command run, rerun it and fetch the stderr to be feed into ChatGPT for help.<p>I am looking to see if anyone find it helpful since I have been using it lightly and only when I hit errors. So of you can try it out when you face errors and share how helpful its solution is. Also open to see if anyone has idea to improve the prompt or how it works.<p>Please note: dont use it with any commands that’s destructive because it would rerun the command. Also dont use with command that contains sensitive information like security tokens etc.",1681772812,2023-04-17 23:06:52 UTC,Show HN: CLI tool to fix command line errors with ChatGPT,story,https://github.com/shahnk19/gpt-comrade,17/4/2023 23:06,1,0,3,1,1,1,0,0,0,0,0,0,0,0,0,0,0,0,0,0,0,1,1,0,0,0,0,0,0,0
jrb_y,,35608640,1,,1681779135,2023-04-18 00:52:15 UTC,GPTest: A VS Code Extension for Testing Your Code with OpenAI's GPT-3,story,https://github.com/JRB-y/gptest,18/4/2023 0:52,0,0,0,0,0,0,0,0,0,0,0,0,0,0,0,0,0,0,0,0,0,0,0,0,0,0,0,0,0,0
shellfly,,35612758,3,,1681818875,2023-04-18 11:54:35 UTC,Show HN: AI Talk – Create two AI discuss on the specific topic automatically,story,https://github.com/aitalk-app/aitalk,18/4/2023 11:54,2,0,1,0,0,0,0,1,0,0,0,0,0,0,0,0,0,0,1,0,0,0,0,1,0,1,0,0,0,0
jasontr,,35616369,1,"As a Medium.com writer, I wanted a simple way to visualize and analyze my articles. I developed Medium-Sky, an open-source app that leverages Medium API, Knowledge Graphs, basic NLP techniques, and ChatGPT to achieve this.",1681835991,2023-04-18 16:39:51 UTC,Show HN: Analyze Medium.com Articles with Knowledge Graphs and NLP,story,https://github.com/justdataplease/medium-sky,18/4/2023 16:39,0,0,0,0,0,0,0,2,2,0,0,0,0,0,0,0,0,0,0,0,0,0,0,0,0,1,1,0,0,0
ybu,,35616871,11,,1681838153,2023-04-18 17:15:53 UTC,Show HN: tokmon – CLI to monitor your program's OpenAI token costs,story,https://github.com/yagil/tokmon,18/4/2023 17:15,1,4,1,0,4,4,0,0,0,0,0,0,0,0,0,0,0,0,1,1,0,0,1,1,0,0,0,0,0,0
pathikrit,,35617747,1,,1681841931,2023-04-18 18:18:51 UTC,Show HN: A tiny toy CLI ChatGPT interface in Node.js (<200 LOC),story,https://github.com/pathikrit/chatgpt-cli,18/4/2023 18:18,1,0,1,0,0,0,1,0,0,0,0,0,0,0,0,0,0,0,0,0,0,0,0,0,1,0,0,0,0,0
liweizhismd,,35625785,2,,1681893006,2023-04-19 08:30:06 UTC,Langtorch: A Java Library for Building Composable LLM Applications,story,https://github.com/Knowly-ai/langtorch,19/4/2023 8:30,75,80,31,17,8,9,89,163,2,0,0,0,43,62,1,0,0,0,13,13,5,3,2,1,5,5,2,0,0,0
stansler,,35626995,1,,1681905033,2023-04-19 11:50:33 UTC,Curated list of Composable AI methods (like HuggingGPT),story,https://github.com/Adamdad/Awesome-ComposableAI,19/4/2023 11:50,20,6,10,5,7,7,0,0,0,0,0,0,0,0,0,0,0,0,0,0,0,2,0,0,0,0,0,0,0,0
awayto,,35627108,1,"Hey there, my name is Joe, and I have just finished my second major project, The Wizard&#x27;s Apprentice. In short, it is intended to be a coding partner that sits along side you and carries out any coding activities that it can.<p>Ultimately I set out to create a group of functionality that would be beneficial while working on a larger project I am developing, Awayto <a href=""https:&#x2F;&#x2F;github.com&#x2F;jcmccormick&#x2F;wc"">https:&#x2F;&#x2F;github.com&#x2F;jcmccormick&#x2F;wc</a>. This is a large scale framework including a Typescript project which defines the api and ui components. I wanted a tool that would help me make new features in the site, as well as continually work on issues, as if it were a subordinate.<p>The Wizard&#x27;s Apprentice has a bunch of functionality I thought was important like being able to manage prompts, control their desired response formats (insofar as rejecting requests that don&#x27;t conform), and give me some insight into the validity and success rates of my prompting.<p>A beta version has just been completed which features a CLI and importable functions so the package can support more use cases and be used for server side tasks if needed. I hope you&#x27;re able to check it out. Any feedback, questions, or comments, are greatly appreciated! Thanks for your time.",1681905963,2023-04-19 12:06:03 UTC,"Show HN: The Wizard's Apprentice, AI-Powered TypeScript Project Suite and CLI",story,https://github.com/keybittech/wizapp,19/4/2023 12:06,1,0,0,0,0,0,1,0,0,0,0,0,0,0,0,0,0,0,0,0,0,0,0,0,1,0,0,0,0,0
snork_alt,,35628690,3,,1681914916,2023-04-19 14:35:16 UTC,Connect your LLM with external data,story,https://github.com/jerryjliu/llama_index,19/4/2023 14:35,2200,1668,1444,1163,1192,61,494,571,530,477,409,22,390,383,443,448,498,19,263,243,206,196,210,13,71,61,75,66,94,10
TheBlapse,,35629141,158,,1681917107,2023-04-19 15:11:47 UTC,Stability AI Launches StableLM: A New Open-Source Language Model,story,https://github.com/Stability-AI/StableLM,19/4/2023 15:11,1271,366,338,299,113,122,0,0,0,4,2,1,0,0,14,2,4,0,126,45,45,32,18,14,0,0,1,2,2,1
dissahc,,35629281,3,,1681917722,2023-04-19 15:22:02 UTC,OpenDuplex – An AI assistant that can call businesses and book appointments,story,https://github.com/anatolybazarov/openduplex,19/4/2023 15:22,3,0,0,0,0,0,0,0,0,0,0,0,0,0,0,0,0,0,0,0,0,0,0,0,0,0,0,0,0,0
themaximalist,,35629528,2,,1681918638,2023-04-19 15:37:18 UTC,"Show HN: Infinity Arcade, interactive LLM text games",story,https://github.com/themaximal1st/InfinityArcade,19/4/2023 15:37,3,2,3,5,1,1,0,5,0,0,0,0,0,0,0,0,0,0,2,0,1,0,0,0,0,1,0,0,0,0
Sugimot0,,35632564,2,,1681934165,2023-04-19 19:56:05 UTC,Gprepo: Load a Git Repo into ChatGPT,story,https://github.com/jtrv/gprepo,19/4/2023 19:56,0,0,0,0,0,0,0,1,0,0,0,0,0,0,0,0,0,0,0,0,0,0,0,0,0,1,0,0,0,0
harlevr,,35633852,2,,1681941635,2023-04-19 22:00:35 UTC,Command Line file transformation with Generative AI,story,https://github.com/harlev/charmr,19/4/2023 22:00,2,2,0,0,0,0,9,0,0,0,0,0,0,0,0,0,0,0,0,0,0,0,0,0,1,0,0,0,0,0
alexgriffiths31,,35633890,5,"ActionIt is a text-to-action library built to make it easier to perform actions based on natural language input. It opens the way for applications that don&#x27;t only retrieve information but actually interact with functions, extracting necessary parameters or asking follow-up questions where necessary.<p>In simple terms, your functions are presented to ChatGPT and the correct one is chosen and executed based on a natural language input.<p>Would love any feedback or feature requests:)",1681941877,2023-04-19 22:04:37 UTC,Show HN: ChatGPT to control your own app (text-to-action library),story,https://github.com/alexgriffithsdev/actionit,19/4/2023 22:04,2,0,0,0,0,0,0,0,0,0,0,0,0,0,2,0,0,0,0,0,0,0,0,0,0,0,1,0,0,0
nestorD,,35635091,33,,1681951629,2023-04-20 00:47:09 UTC,Show HN: Question Extractor: turn text into LLM finetuning data,story,https://github.com/nestordemeure/question_extractor,20/4/2023 0:47,5,7,12,3,6,4,0,1,1,0,0,0,0,2,2,0,0,0,0,3,3,1,2,3,0,2,2,0,0,0
jacobglowbom,,35636927,5,"Hi HN,<p>Today, we&#x27;re launching Glowby Basic, our open-source, customizable AI assistant powered by OpenAI API. It allows you to easily recreate and adapt your own assistant for various needs, with multilingual voice capabilities.<p>Key features include autonomous decision-making, customizable pre-set questions, support for 30+ languages, and effortless prompt switching for different tasks and scenarios.<p>We&#x27;ve made interactions with LLMs and AI-related APIs open-source to encourage collaboration and enhance transparency. Try our live demo (no sign-up required) and explore the GitHub repo linked in the title to start building your own AI assistant.<p>We recognize that there&#x27;s always room for improvement, and we welcome your feedback as we work to make progress.<p>Thank you!",1681970947,2023-04-20 06:09:07 UTC,"Show HN: Customizable, multilingual voice-enabled AI assistant powered by OpenAI",story,https://github.com/glowbom/glowby,20/4/2023 6:09,24,5,4,3,4,2,63,2,4,0,0,0,0,0,0,0,0,0,1,0,3,0,0,0,1,1,1,0,0,0
tjardo,,35639592,1,,1681997265,2023-04-20 13:27:45 UTC,OpenAI Dive: async Rust API client for interacting with OpenAI,story,https://github.com/tjardoo/openai-client,20/4/2023 13:27,4,0,2,0,2,2,9,1,2,9,0,0,0,2,4,1,0,1,1,2,1,0,0,1,1,2,2,1,0,1
mani_mozaffar,,35640327,3,,1682000186,2023-04-20 14:16:26 UTC,"No more fear of job loss, Used AI in a project to get many interviews:)",story,https://github.com/ManiMozaffar/linkedIn-scraper,20/4/2023 14:16,26,6,12,4,5,4,15,2,0,0,0,0,6,5,0,0,0,0,3,2,3,1,2,1,1,2,0,0,0,0
tlowe11,,35641359,16,"Motörhead is an open-source project aimed at helping developers build and manage LLM-based chat applications. We built Motörhead in Rust and it currently handles user sessions and context windows with the following features:<p>-Short-term memory management: Motörhead maintains chat session histories for n users, keeping track of messages sent and received.<p>-Incremental summarization: When the message buffer reaches a maximum window size, Motörhead incrementally summarizes the content into a context key. This process involves taking an existing summary and the messages removed from the list, then generating a new summary.<p>-Semantic search with Redis: All messages are indexed in Redis alongside their respective embeddings, enabling efficient retrieval through semantic search when required.<p>If you’re a developer working with LLM-powered applications please feel free to submit a GH issue for Motörhead and thanks for giving this a read!",1682003544,2023-04-20 15:12:24 UTC,"Show HN: Motörhead, LLM Memory Server Built in Rust",story,https://github.com/getmetal/motorhead,20/4/2023 15:12,175,55,36,36,34,30,14,3,2,11,1,18,14,1,5,14,4,19,10,5,3,10,4,5,3,1,2,4,3,4
dndndnd,,35641838,2,,1682005475,2023-04-20 15:44:35 UTC,Give ChatGPT long-term memory using the OP Stack,story,https://github.com/pashpashpash/vault-ai,20/4/2023 15:44,1215,279,136,110,48,51,1,6,0,0,0,0,4,9,0,0,0,0,112,38,12,12,9,3,5,1,0,0,0,0
cjonas,,35645358,1,"Built this as an experiment to learn more about &quot;ReAct&quot; style agents.  The result is kinda an &quot;Auto-GPT lite&quot;, running natively in Salesforce.<p>Building and running something like this in Salesforce is a MAJOR PITA, but I do think the platform provides an interesting ecosystem to explore use cases.<p>Still needs a lot of work to be &quot;stable&quot;, but I actually could see it being useful for certain use cases.<p>If you&#x27;re interested in checking it out, but don&#x27;t want to fire up an org yourself, I made a demo video: <a href=""https:&#x2F;&#x2F;www.youtube.com&#x2F;watch?v=zLP33ssXUfU"">https:&#x2F;&#x2F;www.youtube.com&#x2F;watch?v=zLP33ssXUfU</a><p>(Sorry for the AI voice over; it&#x27;s more bearable than my own.  And also for the promotion bit at the end; have to justify all the time I spent on this somehow :)",1682020396,2023-04-20 19:53:16 UTC,"Show HN: Apex Agents, LLM Agents Running Natively in Salesforce",story,https://github.com/callawaycloud/llm-apex-agents,20/4/2023 19:53,4,4,0,2,2,1,0,0,0,0,0,0,0,0,0,0,0,0,3,5,0,2,2,0,0,0,0,0,0,0
daiyiyang,,35646429,3,,1682025271,2023-04-20 21:14:31 UTC,OSS ChatGPT Slack bot for nature language data question,story,https://github.com/logunify/dsensei,20/4/2023 21:14,11,0,0,0,0,0,69,0,0,0,0,0,0,0,0,0,0,0,0,0,0,0,0,0,2,0,0,0,0,0
behnamoh,,35646635,1,,1682026203,2023-04-20 21:30:03 UTC,PlayGPT: Share ChatGPT session over web using sharable ChatGPT Docker container,story,https://github.com/BLuFeNiX/PlayGPT,20/4/2023 21:30,1,0,1,2,0,0,0,0,0,0,0,0,0,0,0,0,0,0,0,0,0,0,0,0,0,0,0,0,0,0
diohabara,,35649709,3,,1682049754,2023-04-21 04:02:34 UTC,The ChatGPT-powered decompiler for Python,story,https://github.com/diohabara/pychd,21/4/2023 4:02,8,1,1,0,1,1,0,0,0,0,0,0,0,0,0,0,0,0,1,0,0,0,0,0,0,0,0,0,0,0
eddieweng,,35650754,2,,1682062161,2023-04-21 07:29:21 UTC,ChatGPT Plugins,story,https://github.com/ai-list/awesome-chatgpt-plugins,21/4/2023 7:29,50,8,5,0,1,4,0,0,0,0,0,0,0,0,0,0,0,0,2,1,0,0,0,0,0,0,0,0,0,0
rampantraccoon,,35653428,2,,1682083727,2023-04-21 13:28:47 UTC,Caption-Anything: Combines Segment Anything and ChatGPT,story,https://github.com/ttengwang/Caption-Anything,21/4/2023 13:28,174,103,79,72,43,32,7,1,2,1,0,0,0,0,2,0,0,0,10,5,6,2,3,4,3,1,2,1,0,0
vasinov,,35655777,48,"I am working on a modular open source framework called Griptape that allows Python developers to create LLM pipelines and DAGs for complex workflows that use rules and memory.<p>Griptape can be thought of as &quot;Airflow for LLMs,&quot; providing an alternative to the agent-based LangChain approach.<p>Developers can also build reusable LLM tools with explicit JSON schemas that can be executed in any environment (local, containerized, cloud, etc.) and integrated into Griptape workflows. They can also be easily converted into ChatGPT Plugin APIs and LangChain tools via adapters.<p>Tools can be thought of as any executable code that allows LLMs to interact with the outside world (via ReAct and Toolformer techniques): email, docs, spreadsheets, Jira tickets, web pages&#x2F;search, etc.<p>The best part about tools is that they can be executed in isolated environments, significantly reducing potential security risks associated with running LLM-generated code and API calls.<p>What do you think? What are some of the use cases that you have in mind for reusable tools?",1682092882,2023-04-21 16:01:22 UTC,Show HN: Build AI DAGs with Memory; Run and Validate LLM Tools in Containers,story,https://github.com/griptape-ai/griptape,21/4/2023 16:01,187,67,201,123,104,112,96,103,105,94,305,382,10,18,73,50,135,100,8,7,9,9,20,16,4,5,9,4,10,12
freeqaz,,35661909,4,,1682122238,2023-04-22 00:10:38 UTC,Jailbroken Bark (DeepFake voice AI model) to generate custom audio from any text,story,https://github.com/serp-ai/bark-with-voice-clone,22/4/2023 0:10,373,167,217,205,146,158,11,1,6,1,0,0,5,1,1,0,2,0,71,31,31,42,26,21,5,2,3,1,1,0
ichiichisan,,35669415,2,,1682187218,2023-04-22 18:13:38 UTC,H2O LLM Studio – New open source framework/GUI for fine-tuning LLMs,story,https://github.com/h2oai/h2o-llmstudio,22/4/2023 18:13,414,521,381,172,139,161,166,365,238,247,124,128,40,81,93,58,34,49,40,62,60,18,18,31,11,10,13,9,8,5
wastella,,35672359,2,,1682211582,2023-04-23 00:59:42 UTC,A Primitive LLM Enabled Todo List,story,https://github.com/wastella/gpt4all-todo-list,23/4/2023 0:59,0,0,0,0,0,0,0,0,0,0,0,0,0,0,0,0,0,1,0,0,0,0,0,0,0,0,0,0,0,1
cshou1,,35673927,4,,1682232112,2023-04-23 06:41:52 UTC,Large language model for smart contract auditing,story,https://github.com/fuzzland/audit_gpt,23/4/2023 6:41,16,2,10,8,2,6,0,0,0,0,0,0,0,0,0,0,0,0,3,0,3,2,0,0,0,0,0,0,0,0
pseudotensor,,35674693,2,,1682241729,2023-04-23 09:22:09 UTC,H2oGPT 20B LLM Apache2,story,https://github.com/h2oai/h2ogpt,23/4/2023 9:22,1015,1244,2948,873,666,560,592,564,600,670,349,326,100,123,121,120,93,82,69,140,396,127,93,77,8,13,22,20,16,15
hacker_v_s,,35679450,2,,1682276668,2023-04-23 19:04:28 UTC,Ask any question from your database in plain English with the help of AI,story,https://github.com/vithushanms/engsql-nlp-based-sql-generator,23/4/2023 19:04,0,0,2,0,0,0,0,0,0,0,0,0,0,0,0,0,0,0,0,0,0,0,0,0,0,0,0,0,0,0
minosu,,35681357,132,,1682289223,2023-04-23 22:33:43 UTC,Godot-dodo – Finetuning LLaMA on single-language comment:code data pairs,story,https://github.com/minosvasilias/godot-dodo,23/4/2023 22:33,71,19,10,18,6,8,1,0,0,0,0,0,2,0,0,0,0,0,4,0,0,2,1,1,1,0,0,0,0,0
gelatow,,35683438,2,,1682307822,2023-04-24 03:43:42 UTC,github trending: ChatGPT with Video Understanding,story,https://github.com/OpenGVLab/Ask-Anything,24/4/2023 3:43,496,174,128,85,67,66,46,6,5,3,1,0,7,0,2,0,0,0,41,18,17,8,3,2,4,2,3,1,1,0
lusob,,35692961,1,,1682368917,2023-04-24 20:41:57 UTC,MAIker: AI-powered VSCode extension that generates a code project from a prompt,story,https://github.com/lusob/maiker,24/4/2023 20:41,2,0,0,1,1,0,0,0,0,0,0,0,0,0,0,0,0,0,0,0,0,0,1,0,0,0,0,0,0,0
ngaut,,35694850,3,,1682380712,2023-04-24 23:58:32 UTC,AutoGPT and other GPT and AI tools written in Golang,story,https://github.com/igolaizola/igogpt,24/4/2023 23:58,18,6,5,2,1,0,1,0,9,0,0,1,2,0,13,0,0,3,3,0,0,1,0,0,1,0,1,0,0,1
cloudking,,35701260,3,,1682434181,2023-04-25 14:49:41 UTC,NeMo Guardrails for LLM safety and trustworthiness,story,https://github.com/NVIDIA/NeMo-Guardrails,25/4/2023 14:49,523,234,104,175,214,157,7,8,14,4,12,7,5,10,24,6,8,12,49,18,13,19,20,10,4,5,7,6,6,5
yunyu,,35702757,54,,1682440220,2023-04-25 16:30:20 UTC,Clarity Reader: LLM powered depth-first reading for complex documents,story,https://github.com/1rgs/clarity-reader,25/4/2023 16:30,72,8,2,3,1,1,1,0,0,2,0,0,0,0,0,0,0,0,2,1,0,1,0,0,1,0,0,1,0,0
3dm4r,,35708432,10,ChatGPT is excellent but you need to do a lot of copy and pasting for using it as a coding assistant. I created a simple plugin to give ChatGPT access to the web for documentation and also to the local file system.,1682468898,2023-04-26 00:28:18 UTC,Show HN: ChatGPT Code Assistant,story,https://github.com/edmar/chatgpt-code-assistant,26/4/2023 0:28,13,4,5,3,2,1,2,0,0,0,0,0,3,0,0,0,0,0,1,0,1,0,0,0,2,0,0,0,0,0
brucethemoose2,,35708989,3,,1682474825,2023-04-26 02:07:05 UTC,CodeCapybara: Code Writing LLaMa Finetuned on Deepmind Dataset,story,https://github.com/AI4Code-Research/CodeCapybara,26/4/2023 2:07,0,0,0,0,0,0,0,0,0,0,0,0,0,0,0,0,0,0,0,0,0,0,0,0,0,0,0,0,0,0
franze,,35712485,3,,1682511380,2023-04-26 12:16:20 UTC,Show HN: Rewrite AI – Rewrite the Content on Every Page (Chrome Extension),story,https://github.com/franzenzenhofer/rewriteai,26/4/2023 12:16,1,0,0,1,0,0,1,0,0,0,0,0,0,0,0,0,0,0,1,0,1,0,0,0,1,0,0,0,0,0
bwgerber,,35713318,2,,1682515619,2023-04-26 13:26:59 UTC,Beginner's Guide to ChatGPT,story,https://github.com/bg-write/chatGPT-cheatsheet,26/4/2023 13:26,16,13,13,7,2,4,1,0,0,0,0,0,0,0,0,0,0,0,0,1,0,0,0,1,1,0,0,0,0,0
knrz,,35718916,8,"Hey HN! Been working on this library for architecting stateful LLM agent trees that execute in parallel. Think of it like a AI scheduler for BabyAGIs or AutoGPTs, like:<p>-----<p>Parent (Plan and Adjust): Chief Revenue Officer &#x2F; VP Sales<p>Children (Do and Check): 3 Sales Development Representatives; 2 Account Managers; 1 Market Researcher.<p>You can give the CRO a task and it will break it down, distribute it appropriately to its children, and the children will work in parallel on the task.<p>-----<p>Curious to hear your feedback first HN, we&#x27;re launching on Twitter tomorrow!",1682538139,2023-04-26 19:42:19 UTC,Show HN: Agent Actors – Plan-Do-Check-Adjust with Parallelized LLM Agent Trees,story,https://github.com/shaman-ai/agent-actors,26/4/2023 19:42,77,20,17,13,1,3,6,0,5,0,0,0,3,0,3,0,0,0,5,3,4,3,0,0,2,0,2,0,0,0
medv,,35719700,2,,1682541719,2023-04-26 20:41:59 UTC,Show HN: Damka – Checkers (Draughts) AI,story,https://github.com/antonmedv/damka,26/4/2023 20:41,9,2,0,1,1,1,10,0,0,2,0,0,0,0,0,2,0,0,0,0,0,0,0,0,1,0,0,1,0,0
anton5mith2,,35726934,14,,1682597947,2023-04-27 12:19:07 UTC,LocalAI: Local models on CPU with OpenAI compatible API,story,https://github.com/go-skynet/LocalAI,27/4/2023 12:19,3581,2090,1356,1257,931,888,465,323,230,161,154,150,417,311,167,160,126,108,385,137,116,96,113,81,18,11,17,11,14,10
ybu,,35733337,6,,1682623675,2023-04-27 19:27:55 UTC,Self-hosted dashboard for monitoring your OpenAI API usage,story,https://github.com/yagil/tokmon-beam,27/4/2023 19:27,2,1,1,0,0,2,0,0,0,0,0,0,0,0,0,0,0,0,0,0,0,0,0,0,0,0,0,0,0,0
varunkmohan,,35734274,2,,1682628253,2023-04-27 20:44:13 UTC,Show HN: Codeium-Chrome: Free open-source AI autocomplete Chrome extension,story,https://github.com/Exafunction/codeium-chrome,27/4/2023 20:44,21,7,2,3,7,4,6,3,3,7,1,2,8,4,4,11,2,4,4,0,1,2,0,1,1,2,2,2,1,1
