by,dead,discussion_id,score,text,time,timestamp,title,type,url,date,stars_at_submission,stars_month_1,stars_month_2,stars_month_3,stars_month_4,stars_month_5,commits_at_submission,commits_month_1,commits_month_2,commits_month_3,commits_month_4,commits_month_5,pull_requests_at_submission,pull_requests_month_1,pull_requests_month_2,pull_requests_month_3,pull_requests_month_4,pull_requests_month_5,forks_at_submission,forks_month_1,forks_month_2,forks_month_3,forks_month_4,forks_month_5,contributors_at_submission,contributors_month_1,contributors_month_2,contributors_month_3,contributors_month_4,contributors_month_5
georgecmu,,31306414,4,,1652032804,2022-05-08 18:00:04 UTC,"ML-Course-Notes: Sharing course notes on all ML, NLP, and AI topics",story,https://github.com/dair-ai/ML-Course-Notes,8/5/2022 18:00,1724,220,1743,121,68,96,3,0,11,0,0,1,2,0,2,0,0,0,289,55,187,24,6,21,2,0,2,0,0,1
dhuynh95,,31355348,32,,1652368380,2022-05-12 15:13:00 UTC,"BlindAI: Open-source, fast and privacy-friendly AI deployment solution in Rust",story,https://github.com/mithril-security/blindai,12/5/2022 15:13,146,10,8,13,16,13,52,55,28,114,70,56,23,25,12,21,27,21,5,1,2,0,3,2,5,8,5,6,4,6
bkmn,,31395616,2,,1652699948,2022-05-16 11:19:08 UTC,The AI Music Generation Challenge 2022,story,https://github.com/boblsturm/aimusicgenerationchallenge2022,16/5/2022 11:19,2,4,0,0,1,0,0,1,0,0,2,0,0,0,0,0,0,0,0,0,0,0,0,0,0,1,0,0,1,0
ArdelleF,,31405976,36,,1652761021,2022-05-17 04:17:01 UTC,OpenAI Codex Python to C++ Code Generator,story,https://github.com/alxschwrz/codex_py2cpp,17/5/2022 4:17,63,17,17,16,13,9,0,0,0,0,0,0,0,0,0,0,0,0,7,1,1,3,1,1,0,0,0,0,0,0
mmmmkay,,31459027,3,,1653148922,2022-05-21 16:02:02 UTC,"Ailia-models: A collection of pre-trained, state-of-the-art AI models",story,https://github.com/axinc-ai/ailia-models,21/5/2022 16:02,94,63,50,47,46,51,73,60,46,24,84,52,30,22,25,10,26,31,16,12,12,9,7,9,7,8,9,6,7,7
maydemir,,31472727,2,,1653253229,2022-05-22 21:00:29 UTC,Hanlp – Natural language processing for the next decade,story,https://github.com/hankcs/HanLP,22/5/2022 21:00,290,265,276,288,310,269,34,7,11,9,0,5,0,0,2,4,0,1,117,84,99,108,125,102,1,1,2,3,0,2
walterwhd,,31475204,1,,1653278233,2022-05-23 03:57:13 UTC,A large-scale game AI distributed training platform developed for StarCraftII,story,https://github.com/opendilab/DI-star,23/5/2022 3:57,349,55,42,191,50,69,9,3,1,0,1,0,0,8,0,0,2,0,32,9,5,24,4,4,1,3,1,0,2,0
sanjayaksaxena3,,31521467,12,,1653587915,2022-05-26 17:58:35 UTC,Show HN: Developer Friendly Natural Language Processing,story,https://github.com/winkjs/wink-nlp,26/5/2022 17:58,28,17,11,16,24,350,0,0,0,0,6,7,0,0,0,0,0,0,1,0,0,0,2,7,0,0,0,0,1,1
Psychosecurity,,31524104,1,,1653604458,2022-05-26 22:34:18 UTC,Show HN: DeepFail: Potential way to “mine” AI generated failures,story,https://github.com/HyperCrowd-OpenSource/deepfail,26/5/2022 22:34,0,0,0,0,0,0,0,0,0,0,0,0,0,0,0,0,0,0,0,0,0,0,0,0,0,0,0,0,0,0
davidbarker,,31649385,2,,1654570792,2022-06-07 02:59:52 UTC,Human: AI-powered face and body detection/recognition JavaScript library,story,https://github.com/vladmandic/human,7/6/2022 2:59,64,39,55,33,58,44,4,19,20,29,6,23,0,2,0,2,0,0,9,9,9,9,10,2,1,2,1,2,1,1
triaste,,31735537,3,,1655189308,2022-06-14 06:48:28 UTC,IBM AI Descartes: Combining Data and Theory for Derivable Scientific Discovery,story,https://github.com/IBM/AI-Descartes,14/6/2022 6:48,0,1,1,1,0,2,3,0,0,0,4,0,1,0,0,0,0,0,0,0,0,0,0,1,3,0,0,0,1,0
cjstein,,31747185,3,,1655248532,2022-06-14 23:15:32 UTC,List of AI audio/music tech startups,story,https://github.com/csteinmetz1/ai-audio-startups,14/6/2022 23:15,688,80,35,30,22,18,26,4,3,5,0,0,47,11,6,4,0,0,51,6,8,1,5,2,18,7,3,2,0,0
OutSorcerer,,31822229,1,,1655806157,2022-06-21 10:09:17 UTC,"Train an AI model on Android without coding, make your own app with it",story,https://github.com/OutSorcerer/pocket-automl-android-tutorial,21/6/2022 10:09,0,0,2,0,2,0,0,0,0,0,0,0,0,0,0,0,0,0,0,1,0,1,0,0,0,0,0,0,0,0
modinfo,,31831437,27,,1655865106,2022-06-22 02:31:46 UTC,Gemini with IPFS,story,https://github.com/JonStratton/geminipfs,22/6/2022 2:31,0,0,0,0,0,0,0,0,0,0,0,0,0,0,0,0,0,0,0,0,0,0,0,0,0,0,0,0,0,0
f311a,,31846593,736,,1655974826,2022-06-23 09:00:26 UTC,YaLM-100B: Pretrained language model with 100B parameters,story,https://github.com/yandex/YaLM-100B,23/6/2022 9:00,276,59,41,30,26,68,0,0,0,0,0,0,1,0,0,0,0,0,29,5,3,2,5,6,1,0,0,0,0,0
hanyiwang,,31946963,2,,1656686184,2022-07-01 14:36:24 UTC,Open source AI docstring generator,story,https://github.com/mintlify/writer,1/7/2022 14:36,421,92,78,51,72,73,2,5,0,0,0,4,3,0,0,0,0,2,9,2,3,5,2,6,2,1,0,0,0,2
legel,,32091581,3,,1657768627,2022-07-14 03:17:07 UTC,Show HN: Blender Python 3D simulator for computer vision and inverse render AI,story,https://github.com/3cology/3d_inverse_renderer,14/7/2022 3:17,6,2,1,0,0,1,4,0,0,0,0,0,0,0,0,0,0,0,1,0,0,0,0,1,1,0,0,0,0,0
jakobov,,32163671,2,,1658312452,2022-07-20 10:20:52 UTC,Show HN: AI Safety Cheatsheet,story,https://github.com/Jakobovski/ai-safety-cheatsheet,20/7/2022 10:20,1,0,3,0,0,1,0,0,0,0,0,0,0,0,0,0,0,0,0,0,0,0,0,0,0,0,0,0,0,0
orhanerday,,32346089,1,,1659635638,2022-08-04 17:53:58 UTC,"This Go package fully generated by AI's(Copilot, OpenAI and DALL·E)",story,https://github.com/utfd/slack-alerts,4/8/2022 17:53,6,0,0,0,0,0,8,0,0,0,0,0,0,0,0,0,0,0,0,0,0,0,0,0,1,0,0,0,0,0
RafelMri,,32458048,283,,1660472194,2022-08-14 10:16:34 UTC,Paradigms of Artificial Intelligence Programming (1992),story,https://github.com/norvig/paip-lisp,14/8/2022 10:16,344,47,33,33,29,29,0,0,0,0,0,0,2,0,1,0,0,1,11,5,5,10,2,2,2,0,1,0,0,1
pjfin123,,32461511,2,,1660500939,2022-08-14 18:15:39 UTC,Argos AI Adventure – A text based adventure game written with GitHub Copilot,story,https://github.com/argosopentech/argos-ai-adventure,14/8/2022 18:15,4,0,0,0,0,0,8,0,0,0,0,0,0,0,0,0,0,0,0,0,0,0,0,0,2,0,0,0,0,0
jxireal,,32469173,1,,1660568865,2022-08-15 13:07:45 UTC,MultiSeq2seq Transformer Model for NLP,story,https://github.com/nlptechbook/MultiSeq2seqTransformerNLP,15/8/2022 13:07,2,0,0,0,0,0,5,0,0,0,0,0,0,0,0,0,0,0,0,0,0,0,0,0,1,0,0,0,0,0
jarrell_mark,,32505123,1,,1660795493,2022-08-18 04:04:53 UTC,Show HN: AI Upscaler for Blender Using Real-ESRGAN,story,https://github.com/jarrellmark/ai_upscaler_for_blender,18/8/2022 4:04,8,1,4,3,3,2,0,0,0,0,0,0,0,0,0,0,0,0,0,0,0,0,0,0,0,0,0,0,0,0
telotortium,,32614821,3,,1661565337,2022-08-27 01:55:37 UTC,Rclip: AI-Powered Command-Line Photo Search Tool Using CLIP,story,https://github.com/yurijmikhalevich/rclip,27/8/2022 1:55,41,10,23,5,9,9,0,2,0,0,8,21,0,2,0,0,5,4,2,2,1,0,1,0,0,1,0,0,1,1
thunderbong,,32631608,2,,1661717304,2022-08-28 20:08:24 UTC,Jfa-WhatsApp-chatbot: Node.js micro framework for WhatsApp Chatbot,story,https://github.com/jfadev/jfa-whatsapp-chatbot,28/8/2022 20:08,5,1,1,0,2,1,0,0,3,0,4,0,0,0,0,0,0,0,1,0,0,0,0,1,0,0,1,0,1,0
monort,,32668668,1,,1661981720,2022-08-31 21:35:20 UTC,A plug-in for Krita that enables the use of AI models for img2img generation,story,https://github.com/nousr/koi,31/8/2022 21:35,279,27,5,6,10,6,66,0,0,0,3,0,20,2,0,1,0,1,25,1,1,1,4,0,6,1,0,1,1,1
napolux,,32677605,1,,1662045472,2022-09-01 15:17:52 UTC,Awesome AI image synthesis,story,https://github.com/altryne/awesome-ai-art-image-synthesis,1/9/2022 15:17,610,85,37,51,43,71,3,0,0,0,0,0,9,0,0,1,0,0,33,9,5,7,4,8,3,0,0,1,0,0
jakiestfu,,32679594,2,,1662052215,2022-09-01 17:10:15 UTC,Stability-Ts: A TypeScript CLI for Running Stable Diffusion Through Stability AI,story,https://github.com/jakiestfu/stability-ts,1/9/2022 17:10,40,40,29,5,8,5,9,0,0,0,0,0,3,0,3,0,0,0,5,5,3,2,2,1,2,0,1,0,0,0
walterbell,,32697632,12,,1662168402,2022-09-03 01:26:42 UTC,"DeepCamera: Local inference engine, Home Assistant intrusion detection AI camera",story,https://github.com/SharpAI/DeepCamera,3/9/2022 1:26,80,47,29,15,23,15,103,9,1,0,1,0,13,5,0,0,0,0,5,10,5,8,1,3,2,3,1,0,1,0
llui85,,32701115,10,,1662207603,2022-09-03 12:20:03 UTC,DocQuery: Document Query Engine Powered by Natural Language Processing,story,https://github.com/impira/docquery,3/9/2022 12:20,986,132,55,24,43,31,57,1,0,0,0,1,39,0,0,0,1,0,29,11,7,4,8,7,8,1,0,0,1,1
plutar,,32715657,8,,1662313808,2022-09-04 17:50:08 UTC,Show HN:Choose Your own adventure game using Openai,story,https://github.com/JoshCLWren/cya,4/9/2022 17:50,7,0,0,0,0,1,15,0,0,0,0,0,2,0,0,0,0,0,0,1,0,0,0,0,1,0,0,0,0,0
jph,,32742213,6,,1662493257,2022-09-06 19:40:57 UTC,Show HN: Stable Diffusion image gallery of 300 AI generated pictures,story,https://github.com/joelparkerhenderson/stable-diffusion-image-gallery,6/9/2022 19:40,9,0,0,0,0,0,115,0,0,0,0,0,0,0,0,0,0,0,0,0,0,0,0,0,1,0,0,0,0,0
phsilva,,32768572,2,,1662657419,2022-09-08 17:16:59 UTC,An autoregressive character-level language model for making more things,story,https://github.com/karpathy/makemore,8/9/2022 17:16,153,106,79,48,119,125,3,0,1,0,0,0,2,0,1,1,2,0,30,24,21,18,48,65,2,0,2,1,1,0
todsacerdoti,,32822157,5,,1663061148,2022-09-13 09:25:48 UTC,A command-line tool to create development environments for AI/ML based on build,story,https://github.com/tensorchord/envd,13/9/2022 9:25,292,92,130,110,78,44,81,116,80,77,75,43,146,194,130,139,131,91,19,17,15,9,11,1,11,19,16,16,13,12
dgurney,,32887739,1,,1663510504,2022-09-18 14:15:04 UTC,Show HN: Make Your Own OpenAI-Powered Chatbot,story,https://github.com/dgurns/make-your-own-chatbot,18/9/2022 14:15,0,0,2,2,0,1,0,0,0,0,0,0,0,0,0,0,0,0,0,0,0,0,1,0,0,0,0,0,0,0
myth_drannon,,32900797,336,,1663606241,2022-09-19 16:50:41 UTC,AI Seamless Texture Generator Built-In to Blender,story,https://github.com/carson-katri/dream-textures,19/9/2022 16:50,565,173,1507,513,238,258,104,19,85,73,22,30,54,11,29,21,9,5,33,17,80,30,23,16,3,3,6,6,2,3
stephanst,,32912301,3,"I&#x27;m trying to figure out whether there is a real business in building AI systems for UAV. I&#x27;m developing a few different products that all work together, and the most basic one is maybe this AI component that simply detects ground obstacles outputting a single class for safe areas. If you use it I&#x27;d love to hear any feedback!",1663684951,2022-09-20 14:42:31 UTC,Show HN: I made an AI for drones to land safely,story,https://github.com/stephansturges/OpenLander,20/9/2022 14:42,18,9,4,8,2,3,10,6,9,9,0,0,0,0,1,1,0,0,2,1,2,1,0,0,1,1,2,1,0,0
Yousef0M,,32955862,2,,1663960297,2022-09-23 19:11:37 UTC,"AI guesses your sketchy drawing ""Inspired by quick draw from Google"".",story,https://github.com/Yousef0M/BetterThanQuickDraw,23/9/2022 19:11,0,0,0,0,0,0,0,0,0,0,0,0,0,0,0,0,0,0,0,0,0,0,0,0,0,0,0,0,0,0
blopeur,,32964359,2,,1664038092,2022-09-24 16:48:12 UTC,Awful AI,story,https://github.com/daviddao/awful-ai,24/9/2022 16:48,95,20,23,54,53,39,0,0,7,0,1,0,0,0,3,0,0,1,2,1,1,1,2,2,0,0,1,0,1,1
importgravity,,33082914,1,,1664901577,2022-10-04 16:39:37 UTC,Best Practices on Explainable AI,story,https://github.com/squaredev-io/explainable-ai,4/10/2022 16:39,92,35,2,4,4,0,16,0,0,2,1,0,5,0,0,2,2,0,3,0,0,0,2,0,3,0,0,2,2,0
aaronharnly,,33114316,1,,1665091693,2022-10-06 21:28:13 UTC,Light-Switch-AI: The world's most needlessly intelligent light switch,story,https://github.com/Bemmu/Light-Switch-AI,6/10/2022 21:28,17,5,1,2,1,5,1,0,0,0,0,0,0,0,0,0,0,0,4,0,0,0,0,0,1,0,0,0,0,0
Der_Einzige,,33122939,3,,1665157725,2022-10-07 15:48:45 UTC,Show HN: An AI writing assistant and text generation studio,story,https://github.com/Hellisotherpeople/Constrained-Text-Generation-Studio,7/10/2022 15:48,25,8,1,2,5,5,5,0,0,0,1,0,0,0,0,0,0,0,1,2,1,0,0,1,1,0,0,0,1,0
georgehill,,33128325,2,,1665186037,2022-10-07 23:40:37 UTC,Predicting the Future of AI with AI,story,https://github.com/artificial-scientist-lab/FutureOfAIviaAI,7/10/2022 23:40,35,1,0,2,1,1,2,0,0,0,0,0,0,0,0,0,0,0,2,0,0,0,1,0,1,0,0,0,0,0
freeqaz,,33160939,3,,1665478587,2022-10-11 08:56:27 UTC,"Open Source AI to generate code, competitive with OpenAI Codex/GitHub Copilot",story,https://github.com/salesforce/CodeGen,11/10/2022 8:56,103,350,113,166,210,471,0,0,1,0,0,0,0,1,0,0,0,0,7,16,11,16,19,30,0,1,1,0,0,0
freediver,,33229749,2,,1665979870,2022-10-17 04:11:10 UTC,Betafish: A Chess Engine and AI Move Finder,story,https://github.com/Strryke/betafish,17/10/2022 4:11,5,5,5,2,3,2,0,0,0,0,0,0,0,0,0,0,0,0,2,0,0,0,1,1,0,0,0,0,0,0
jmcgough,,33241007,2,,1666049768,2022-10-17 23:36:08 UTC,AI-based playthrough of Final Fantasy X,story,https://github.com/coderwilson/FFX_TAS_Python,17/10/2022 23:36,4,0,0,0,0,1,210,107,0,0,5,0,144,65,1,1,3,0,0,0,0,0,0,0,5,3,1,1,1,0
thunderbong,,33263748,31,,1666193852,2022-10-19 15:37:32 UTC,Text generator: an Obsidian plugin that generates text using GPT-3 (OpenAI),story,https://github.com/nhaouari/obsidian-textgenerator-plugin,19/10/2022 15:37,81,91,70,55,215,89,13,19,0,0,23,22,0,2,2,0,4,7,5,5,8,5,18,12,1,2,1,0,2,4
fermip,,33269101,4,,1666222086,2022-10-19 23:28:06 UTC,OpenAI Codex English to Python Code Generator,story,https://github.com/alxschwrz/codex_english2python,19/10/2022 23:28,2,1,0,0,1,0,0,0,0,0,0,0,0,0,0,0,0,0,0,0,0,0,0,0,0,0,0,0,0,0
rahimnathwani,,33278785,79,,1666290805,2022-10-20 18:33:25 UTC,Buzz: Transcribe audio from your microphones in real-time using OpenAI's Whisper,story,https://github.com/chidiwilliams/buzz,20/10/2022 18:33,664,471,321,661,1465,1217,121,187,249,7,26,113,51,87,59,6,14,32,35,26,27,43,115,87,2,3,3,2,2,4
edouard-harris,,33324562,1,,1666657565,2022-10-25 00:26:05 UTC,POWERplay: A toolchain to study AI power-seeking,story,https://github.com/gladstoneai/POWERplay,25/10/2022 0:26,1,1,1,1,0,0,0,0,0,0,0,0,0,0,0,0,0,0,1,0,2,0,0,0,0,0,0,0,0,0
elleven,,33334781,3,,1666724528,2022-10-25 19:02:08 UTC,Using OpenAI Codex's “DaVinci-Edit” Model for Gradual Type Inference,story,https://github.com/GammaTauAI/opentau,25/10/2022 19:02,1,5,1,1,11,23,51,43,1,25,60,86,0,0,0,0,0,0,0,0,0,0,3,2,2,2,1,1,2,1
ushakov,,33362694,2,,1666898609,2022-10-27 19:23:29 UTC,AI Render – Stable Diffusion in Blender,story,https://github.com/benrugg/AI-Render,27/10/2022 19:23,129,42,39,35,39,64,33,9,2,0,5,26,17,1,2,0,2,1,9,5,4,3,4,6,3,2,2,0,2,2
carefree0910,,33393881,200,"I have been dreaming of creating things (arts, games, etc.), but that wouldn&#x27;t be possible because I can hardly draw anything. But now with Stable Diffusion everything is hopeful again, so I further collected the AI magics that I considered necessary in creation activities, and integrated them into an Infinite draw board (like Figma).<p>Hope that I can hear from you, any advice or suggestions will be really appreciated!",1667133154,2022-10-30 12:32:34 UTC,Show HN: AI magics meet Infinite draw board,story,https://github.com/carefree0910/carefree-creator,30/10/2022 12:32,646,44,50,58,52,37,26,21,11,6,7,15,0,0,0,0,0,2,32,6,6,7,8,7,1,1,1,1,1,2
stanislavb,,33537554,5,,1668026613,2022-11-09 20:43:33 UTC,A plugin for GPT-3 AI assisted note taking in Logseq,story,https://github.com/briansunter/logseq-plugin-gpt3-openai,9/11/2022 20:43,55,62,57,44,106,39,10,5,9,0,14,0,4,3,10,0,10,1,4,6,2,3,9,3,2,3,4,0,3,1
jeadie,,33686135,3,"Play locally, play over websockets. A simple program to play against the computer, or with others over websocket.<p>I need to improve the local computer agent (using some better probability theory), but I wonder if there is much AI research for liar&#x27;s dice or dice based game I could implement?",1668983223,2022-11-20 22:27:03 UTC,"Show HN: A simple, terminal game of liar's dice for human, computer and AI",story,https://github.com/Jeadie/liars-dice,20/11/2022 22:27,0,0,0,1,0,0,0,0,0,0,0,0,0,0,0,0,0,0,0,0,0,0,0,0,0,0,0,0,0,0
medv,,33703274,48,,1669104570,2022-11-22 08:09:30 UTC,Show HN: Llama – Terminal File Manager,story,https://github.com/antonmedv/llama,22/11/2022 8:09,85,36,164,46,28,23,4,3,1,0,2,0,9,2,5,1,3,0,7,2,4,3,4,1,6,4,5,1,4,0
pat-jay,,33742214,1,,1669383323,2022-11-25 13:35:23 UTC,A list of online news and info sources in the AI/ML/Data Science space,story,https://github.com/foorilla/allainews_sources,25/11/2022 13:35,1,1,0,0,1,3,0,0,0,0,4,2,0,0,0,0,0,1,0,0,0,0,1,0,0,0,0,0,1,1
videlov,,33743362,2,,1669390920,2022-11-25 15:42:00 UTC,"Show HN: Suspicious – Catching bugs in code with AI, fully local CLI app",story,https://github.com/sturdy-dev/suspicious,25/11/2022 15:42,5,2,1,2,0,0,0,3,0,0,0,0,0,0,0,0,0,0,1,0,0,0,0,0,0,1,0,0,0,0
Baihai_IDP,,33783452,1,,1669693616,2022-11-29 03:46:56 UTC,A new open-source AI IDE with native support for Python and SQL,story,https://github.com/BaihaiAI/IDP,29/11/2022 3:46,3,0,48,27,25,10,0,0,8,12,1,0,0,0,9,1,0,0,1,0,7,3,5,1,0,0,5,3,1,0
tosh,,33816253,4,,1669903149,2022-12-01 13:59:09 UTC,ChatGPT's solutions to Advent of Code 2022,story,https://github.com/ishan0102/aoc-2022-chatgpt,1/12/2022 13:59,13,0,0,0,0,0,8,0,0,0,0,0,0,0,0,0,0,0,3,0,0,0,0,0,1,0,0,0,0,0
golergka,,33818306,7,,1669911390,2022-12-01 16:16:30 UTC,Show HN: Solving Advent of Code with ChatGPT,story,https://github.com/golergka/advent-of-code-2022-with-chat-gpt,1/12/2022 16:16,35,0,0,0,0,1,5,0,0,0,0,0,2,0,0,0,0,0,7,0,0,1,0,0,2,0,0,0,0,0
_pdp_,,33828293,7,,1669971308,2022-12-02 08:55:08 UTC,Show HN: I made a Google Chrome extension automatically with ChatGPT,story,https://github.com/pdparchitect/ChatGPT-Assistant,2/12/2022 8:55,145,6,8,7,4,1,1,0,0,0,0,0,0,0,0,0,0,0,10,0,0,1,1,0,1,0,0,0,0,0
louis030195,,33828347,1,"Experimental search engine for conversational AI such as parl.ai, large language models such as OpenAI GPT3, and humans (maybe).",1669971923,2022-12-02 09:05:23 UTC,Show HN: Search engine for conversational AI and large language models,story,https://github.com/langa-me/cerche,2/12/2022 9:05,3,0,0,1,0,0,2,0,0,0,0,0,0,0,0,0,0,0,0,0,0,0,0,0,1,0,0,0,0,0
louis030195,,33828866,1,,1669977762,2022-12-02 10:42:42 UTC,Show HN: Open-source AI-generated conversation card game,story,https://github.com/another-ai/card-game,2/12/2022 10:42,1,0,0,0,0,0,0,0,0,0,0,0,0,0,0,0,0,0,0,0,0,0,0,0,0,0,0,0,0,0
_pdp_,,33828953,1,,1669978679,2022-12-02 10:57:59 UTC,"Show HN: ChatGPT Pong – A fun game of pong, created by OpenAI",story,https://github.com/pdparchitect/ChatGPT-Pong,2/12/2022 10:57,7,0,0,1,0,0,8,0,0,0,0,0,0,0,0,0,0,0,1,0,0,0,0,0,1,0,0,0,0,0
gigapotential,,33838046,2,,1670021358,2022-12-02 22:49:18 UTC,Show HN: Async Rust Library for OpenAI,story,https://github.com/64bit/async-openai,2/12/2022 22:49,24,18,17,209,81,58,61,7,5,27,5,1,33,6,6,29,6,4,2,4,3,23,4,7,2,1,3,11,2,2
falleng0d,,33846456,45,,1670095771,2022-12-03 19:29:31 UTC,AI Downloader – A Python file downloader written by AI,story,https://github.com/falleng0d/ai-downloader,3/12/2022 19:29,24,0,0,0,0,0,4,0,0,0,0,0,0,0,0,0,0,0,1,1,0,0,0,0,1,0,0,0,0,0
jiayuanzhang,,33852572,38,,1670152617,2022-12-04 11:16:57 UTC,"Show HN: GPTLang, a New Programming Language Implemented by ChatGPT",story,https://github.com/forrestchang/gptlang,4/12/2022 11:16,185,7,10,101,16,4,7,0,0,7,0,0,0,0,0,0,0,0,6,2,1,3,1,2,1,0,0,1,0,0
wonderfuly,,33853773,431,,1670162505,2022-12-04 14:01:45 UTC,Show HN: Chrome extension to display ChatGPT response besides Google Search,story,https://github.com/wong2/chat-gpt-google-extension,4/12/2022 14:01,6818,1212,0,0,0,0,118,28,0,0,0,0,79,20,0,0,0,0,418,149,0,0,0,0,22,9,0,0,0,0
nudpiedo,,33854638,231,,1670168589,2022-12-04 15:43:09 UTC,Show HN: Whole Git repo was made with ChatGPT,story,https://github.com/vrescobar/chatGPT-python-elm,4/12/2022 15:43,99,3,1,0,5,0,4,0,0,0,0,0,4,0,0,0,0,0,5,0,0,0,0,0,3,0,0,0,0,0
peterdemin,,33855085,4,,1670171532,2022-12-04 16:32:12 UTC,Show HN: Command-Line Interface to ChatGPT,story,https://github.com/peterdemin/openai-cli,4/12/2022 16:32,21,16,12,21,13,8,15,0,4,0,0,0,2,1,2,0,0,0,3,3,3,4,5,1,2,1,2,0,0,0
crap,,33857707,2,,1670186837,2022-12-04 20:47:17 UTC,Show HN: Query ChatGPT in Neovim,story,https://github.com/terror/chatgpt.nvim,4/12/2022 20:47,151,29,27,29,6,10,22,1,0,0,6,0,9,2,0,0,2,0,2,6,2,1,1,1,1,2,0,0,2,0
pajop,,33858472,1,,1670191623,2022-12-04 22:07:03 UTC,Chrome Extension That Integrates ChatGPT (Unofficial) into Google Search,story,https://github.com/ZohaibAhmed/ChatGPT-Google,4/12/2022 22:07,371,39,23,14,6,5,1,0,0,0,0,0,0,0,0,0,0,0,31,4,5,2,3,3,1,0,0,0,0,0
romanhotsiy,,33858486,4,,1670191727,2022-12-04 22:08:47 UTC,Show HN: Automatically generate commit messages using ChatGPT,story,https://github.com/RomanHotsiy/commitgpt,4/12/2022 22:08,671,103,124,165,69,54,6,1,0,0,0,2,6,2,2,1,1,3,15,3,6,7,7,4,3,2,2,1,1,1
transitivebs,,33858745,1,,1670193480,2022-12-04 22:38:00 UTC,Show HN: Twitter Bot Powered by ChatGPT,story,https://github.com/transitive-bullshit/chatgpt-twitter-bot,4/12/2022 22:38,246,96,67,196,26,24,101,6,27,11,2,0,9,0,1,2,0,0,21,12,7,23,9,11,1,1,1,1,1,0
domeccleston,,33858907,2,"I hadn&#x27;t found a good way to share ChatGPT conversations yet, so I built this (not approved yet) Chrome Extension to help. It adds an &#x27;export&#x27; button to the ChatGPT UI which generates a shareable page with the same styling as chat.open.ai.com.",1670194435,2022-12-04 22:53:55 UTC,Show HN: Share permanent links to ChatGPT conversations in one click,story,https://github.com/domeccleston/chatgpt-extension,4/12/2022 22:53,2,0,0,0,0,0,11,0,0,0,0,0,0,0,0,0,0,0,0,0,0,0,0,0,1,0,0,0,0,0
pajop,,33859420,2,,1670197963,2022-12-04 23:52:43 UTC,Repo is unofficial ChatGPT API. It is based on Daniel Gross's WhatsApp GPT,story,https://github.com/taranjeet/chatgpt-api,4/12/2022 23:52,472,34,38,0,0,0,2,0,0,0,0,0,12,0,0,0,0,0,64,6,3,0,0,0,6,0,0,0,0,0
lovasoa,,33860808,40,,1670208244,2022-12-05 02:44:04 UTC,Show HN: Controversial quiz game generated by ChatGPT,story,https://github.com/lovasoa/Sensitive-Topic-History-Quiz,5/12/2022 2:44,23,1,2,0,0,0,15,0,0,0,0,0,0,0,0,0,0,0,2,0,0,0,0,1,2,0,0,0,0,0
williamfzc,,33862926,1,,1670228830,2022-12-05 08:27:10 UTC,Use ChatGPT to generate PPT automatically,story,https://github.com/williamfzc/chat-gpt-ppt,5/12/2022 8:27,53,35,75,254,130,72,2,3,0,25,0,0,0,4,0,2,0,0,6,6,9,24,12,6,1,2,0,1,0,0
your_challenger,,33869231,116,,1670263547,2022-12-05 18:05:47 UTC,Show HN: Chrome extension to summarize blogs and articles using ChatGPT,story,https://github.com/clmnin/summarize.site,5/12/2022 18:05,360,48,45,46,54,34,8,0,0,6,1,4,4,0,0,3,2,0,14,7,12,5,8,6,2,0,0,2,2,1
ilikenwf,,33870358,1,,1670267620,2022-12-05 19:13:40 UTC,YoutubeDLStreamer – A 99% AI Generated Kodi Addon,story,https://github.com/ilikenwf/plugin.video.youtubedlstreamer,5/12/2022 19:13,2,0,0,0,0,0,1,0,0,0,0,0,0,0,0,0,0,0,2,0,0,0,0,0,1,0,0,0,0,0
olvrng,,33871230,3,,1670271275,2022-12-05 20:14:35 UTC,Show HN: Chrome extension to have ChatGPT as a sidebar,story,https://github.com/iOliverNguyen/chatgpt-extension,5/12/2022 20:14,129,0,0,0,0,0,6,0,0,0,0,0,2,0,0,0,0,0,9,0,0,0,0,0,2,0,0,0,0,0
greshake,,33872062,189,"So, I guess this is the inevitable conclusion with LLMs. Connect them to a real terminal and let them act on real-world objects... I honestly don&#x27;t know whether I like the idea or not, but I guess it&#x27;s good to have this conversation now while it is only a marginally better version of tldr.<p>But you can already use it do do simple tasks like cleaning old files, figuring out what machine you&#x27;re running on or even perform and summarize portscan results.<p>It should go without saying that this should be done on VMs and every command is confirmed and checked by the user...<p>tldr: browsing: enabled",1670275071,2022-12-05 21:17:51 UTC,Tell HN: Giving ChatGPT access to a real terminal,story,https://github.com/greshake/Alice,5/12/2022 21:17,224,38,22,18,15,15,11,0,0,0,0,0,3,0,0,0,0,0,8,6,4,1,1,2,3,0,0,0,0,0
rschiang,,33873184,1,,1670281375,2022-12-05 23:02:55 UTC,"Show HN: Export ChatGPT chats to Markdown, JSON",story,https://github.com/ryanschiang/chatgpt-export,5/12/2022 23:02,18,7,14,14,24,13,9,0,0,0,3,0,0,0,0,0,0,0,1,2,2,3,3,1,1,0,0,0,1,0
transitivebs,,33873768,5,,1670284630,2022-12-05 23:57:10 UTC,Show HN: npm install chatgpt,story,https://github.com/transitive-bullshit/chatgpt-api,5/12/2022 23:57,4104,1440,3608,2567,1166,786,303,37,118,64,25,10,207,31,74,58,24,12,443,206,512,411,194,115,79,16,34,30,11,8
moron4hire,,33876698,1,,1670310164,2022-12-06 07:02:44 UTC,Show HN: ChatGPT prompt to create a text-adventure game,story,https://github.com/capnmidnight/ChatGPT-Adventure,6/12/2022 7:02,17,5,4,5,4,2,2,0,0,0,0,0,0,0,0,0,0,0,1,0,1,2,0,0,1,0,0,0,0,0
